text,created_at,context_annotations
@PepTeam and @ManCity should come against Nottingham Forest this way and bring something new to us man city fans. We need to see some fresh air in this team. See players having more opportunities and playing in a different positioning. Go #manchestercity win again #PepGuardiola https://t.co/SIIJiJb3bS,2024-12-04 02:30:27,"[{'domain': {'id': '3', 'name': 'TV Shows', 'description': 'Television shows from around the world'}, 'entity': {'id': '10053653751', 'name': 'Premier League'}}, {'domain': {'id': '6', 'name': 'Sports Event'}, 'entity': {'id': '1847793679592738816', 'name': 'Manchester City vs Nottingham Forest'}}, {'domain': {'id': '11', 'name': 'Sport', 'description': 'Types of sports, like soccer and basketball'}, 'entity': {'id': '733756536430809088', 'name': 'Soccer'}}, {'domain': {'id': '12', 'name': 'Sports Team', 'description': 'A sports team organization, like Arsenal and the Boston Celtics'}, 'entity': {'id': '731226231404793857', 'name': 'Nottingham Forest FC'}}, {'domain': {'id': '26', 'name': 'Sports League', 'description': ''}, 'entity': {'id': '731226211804794880', 'name': 'England - Soccer'}}, {'domain': {'id': '26', 'name': 'Sports League', 'description': ''}, 'entity': {'id': '733756526872006656', 'name': 'Premier League'}}, {'domain': {'id': '29', 'name': 'Events [Entity Service]', 'description': 'Real world events. '}, 'entity': {'id': '1665772587467653121', 'name': '2024 US Presidential Election', 'description': '2024 US Presidential Election'}}, {'domain': {'id': '29', 'name': 'Events [Entity Service]', 'description': 'Real world events. '}, 'entity': {'id': '1847793679592738816', 'name': 'Manchester City vs Nottingham Forest'}}, {'domain': {'id': '43', 'name': 'Soccer Match', 'description': 'Sports Event specific to Soccer matches'}, 'entity': {'id': '1847793679592738816', 'name': 'Manchester City vs Nottingham Forest'}}, {'domain': {'id': '46', 'name': 'Business Taxonomy', 'description': 'Categories within Brand Verticals that narrow down the scope of Brands'}, 'entity': {'id': '1557697289971322880', 'name': 'Sports & Fitness Business', 'description': 'Brands, companies, advertisers and every non-person handle with the profit intent related to sports nutrition, athletic apparel, sports apps, fitness venues'}}, {'domain': {'id': '131', 'name': 'Unified Twitter Taxonomy', 'description': 'A taxonomy of user interests. '}, 'entity': {'id': '731226231404793857', 'name': 'Nottingham Forest FC'}}, {'domain': {'id': '131', 'name': 'Unified Twitter Taxonomy', 'description': 'A taxonomy of user interests. '}, 'entity': {'id': '733756526872006656', 'name': 'Premier League'}}, {'domain': {'id': '131', 'name': 'Unified Twitter Taxonomy', 'description': 'A taxonomy of user interests. '}, 'entity': {'id': '733756536430809088', 'name': 'Soccer'}}, {'domain': {'id': '131', 'name': 'Unified Twitter Taxonomy', 'description': 'A taxonomy of user interests. '}, 'entity': {'id': '847878884917886977', 'name': 'Politics', 'description': 'Politics'}}, {'domain': {'id': '131', 'name': 'Unified Twitter Taxonomy', 'description': 'A taxonomy of user interests. '}, 'entity': {'id': '847900493514891265', 'name': 'Sports', 'description': 'Sports'}}, {'domain': {'id': '131', 'name': 'Unified Twitter Taxonomy', 'description': 'A taxonomy of user interests. '}, 'entity': {'id': '1291447199595782144', 'name': 'United States politics'}}, {'domain': {'id': '131', 'name': 'Unified Twitter Taxonomy', 'description': 'A taxonomy of user interests. '}, 'entity': {'id': '1665772587467653121', 'name': '2024 US Presidential Election', 'description': '2024 US Presidential Election'}}, {'domain': {'id': '10', 'name': 'Person', 'description': 'Named people in the world like Nelson Mandela'}, 'entity': {'id': '733774535133028352', 'name': 'Pep Guardiola'}}, {'domain': {'id': '11', 'name': 'Sport', 'description': 'Types of sports, like soccer and basketball'}, 'entity': {'id': '733756536430809088', 'name': 'Soccer'}}, {'domain': {'id': '12', 'name': 'Sports Team', 'description': 'A sports team organization, like Arsenal and the Boston Celtics'}, 'entity': {'id': '731226203856637952', 'name': 'Manchester City'}}, {'domain': {'id': '93', 'name': 'Coach', 'description': ""A Coach like 'Bill Belichick'""}, 'entity': {'id': '733774535133028352', 'name': 'Pep Guardiola'}}, {'domain': {'id': '131', 'name': 'Unified Twitter Taxonomy', 'description': 'A taxonomy of user interests. '}, 'entity': {'id': '731226203856637952', 'name': 'Manchester City'}}, {'domain': {'id': '131', 'name': 'Unified Twitter Taxonomy', 'description': 'A taxonomy of user interests. '}, 'entity': {'id': '733756536430809088', 'name': 'Soccer'}}, {'domain': {'id': '131', 'name': 'Unified Twitter Taxonomy', 'description': 'A taxonomy of user interests. '}, 'entity': {'id': '733774535133028352', 'name': 'Pep Guardiola'}}, {'domain': {'id': '131', 'name': 'Unified Twitter Taxonomy', 'description': 'A taxonomy of user interests. '}, 'entity': {'id': '847900493514891265', 'name': 'Sports', 'description': 'Sports'}}, {'domain': {'id': '131', 'name': 'Unified Twitter Taxonomy', 'description': 'A taxonomy of user interests. '}, 'entity': {'id': '1285942425861545984', 'name': 'Sports figures'}}, {'domain': {'id': '29', 'name': 'Events [Entity Service]', 'description': 'Real world events. '}, 'entity': {'id': '733756526872006656', 'name': 'Premier League'}}]"
"@FabrizioRomano @City_Xtra The best coach ever, we have to enjoy before he retires 🙏🏽 #PepGuardiola",2024-12-04 01:54:54,"[{'domain': {'id': '3', 'name': 'TV Shows', 'description': 'Television shows from around the world'}, 'entity': {'id': '10053653751', 'name': 'Premier League'}}, {'domain': {'id': '6', 'name': 'Sports Event'}, 'entity': {'id': '1847793679592738816', 'name': 'Manchester City vs Nottingham Forest'}}, {'domain': {'id': '10', 'name': 'Person', 'description': 'Named people in the world like Nelson Mandela'}, 'entity': {'id': '1303663877104705536', 'name': 'Fabrizio Romano'}}, {'domain': {'id': '11', 'name': 'Sport', 'description': 'Types of sports, like soccer and basketball'}, 'entity': {'id': '733756536430809088', 'name': 'Soccer'}}, {'domain': {'id': '26', 'name': 'Sports League', 'description': ''}, 'entity': {'id': '731226211804794880', 'name': 'England - Soccer'}}, {'domain': {'id': '26', 'name': 'Sports League', 'description': ''}, 'entity': {'id': '733756526872006656', 'name': 'Premier League'}}, {'domain': {'id': '29', 'name': 'Events [Entity Service]', 'description': 'Real world events. '}, 'entity': {'id': '1847793679592738816', 'name': 'Manchester City vs Nottingham Forest'}}, {'domain': {'id': '43', 'name': 'Soccer Match', 'description': 'Sports Event specific to Soccer matches'}, 'entity': {'id': '1847793679592738816', 'name': 'Manchester City vs Nottingham Forest'}}, {'domain': {'id': '46', 'name': 'Business Taxonomy', 'description': 'Categories within Brand Verticals that narrow down the scope of Brands'}, 'entity': {'id': '1557697289971322880', 'name': 'Sports & Fitness Business', 'description': 'Brands, companies, advertisers and every non-person handle with the profit intent related to sports nutrition, athletic apparel, sports apps, fitness venues'}}, {'domain': {'id': '94', 'name': 'Journalist', 'description': ""A journalist like 'Anderson Cooper'""}, 'entity': {'id': '1303663877104705536', 'name': 'Fabrizio Romano'}}, {'domain': {'id': '131', 'name': 'Unified Twitter Taxonomy', 'description': 'A taxonomy of user interests. '}, 'entity': {'id': '733756526872006656', 'name': 'Premier League'}}, {'domain': {'id': '131', 'name': 'Unified Twitter Taxonomy', 'description': 'A taxonomy of user interests. '}, 'entity': {'id': '733756536430809088', 'name': 'Soccer'}}, {'domain': {'id': '131', 'name': 'Unified Twitter Taxonomy', 'description': 'A taxonomy of user interests. '}, 'entity': {'id': '847900493514891265', 'name': 'Sports', 'description': 'Sports'}}, {'domain': {'id': '131', 'name': 'Unified Twitter Taxonomy', 'description': 'A taxonomy of user interests. '}, 'entity': {'id': '1074755059433463813', 'name': 'Sports journalists', 'description': 'Sports Figures'}}, {'domain': {'id': '131', 'name': 'Unified Twitter Taxonomy', 'description': 'A taxonomy of user interests. '}, 'entity': {'id': '1303663877104705536', 'name': 'Fabrizio Romano'}}, {'domain': {'id': '10', 'name': 'Person', 'description': 'Named people in the world like Nelson Mandela'}, 'entity': {'id': '733774535133028352', 'name': 'Pep Guardiola'}}, {'domain': {'id': '11', 'name': 'Sport', 'description': 'Types of sports, like soccer and basketball'}, 'entity': {'id': '733756536430809088', 'name': 'Soccer'}}, {'domain': {'id': '12', 'name': 'Sports Team', 'description': 'A sports team organization, like Arsenal and the Boston Celtics'}, 'entity': {'id': '731226203856637952', 'name': 'Manchester City'}}, {'domain': {'id': '93', 'name': 'Coach', 'description': ""A Coach like 'Bill Belichick'""}, 'entity': {'id': '733774535133028352', 'name': 'Pep Guardiola'}}, {'domain': {'id': '131', 'name': 'Unified Twitter Taxonomy', 'description': 'A taxonomy of user interests. '}, 'entity': {'id': '731226203856637952', 'name': 'Manchester City'}}, {'domain': {'id': '131', 'name': 'Unified Twitter Taxonomy', 'description': 'A taxonomy of user interests. '}, 'entity': {'id': '733756536430809088', 'name': 'Soccer'}}, {'domain': {'id': '131', 'name': 'Unified Twitter Taxonomy', 'description': 'A taxonomy of user interests. '}, 'entity': {'id': '733774535133028352', 'name': 'Pep Guardiola'}}, {'domain': {'id': '131', 'name': 'Unified Twitter Taxonomy', 'description': 'A taxonomy of user interests. '}, 'entity': {'id': '847900493514891265', 'name': 'Sports', 'description': 'Sports'}}, {'domain': {'id': '131', 'name': 'Unified Twitter Taxonomy', 'description': 'A taxonomy of user interests. '}, 'entity': {'id': '1285942425861545984', 'name': 'Sports figures'}}, {'domain': {'id': '29', 'name': 'Events [Entity Service]', 'description': 'Real world events. '}, 'entity': {'id': '733756526872006656', 'name': 'Premier League'}}]"
"@FabrizioRomano @City_Xtra Pep always keeps it real! Winning does make everything look better, but he's got that passion whether it's a win or not. 😂🔥 #ManCity #PepGuardiola",2024-12-04 01:53:38,"[{'domain': {'id': '3', 'name': 'TV Shows', 'description': 'Television shows from around the world'}, 'entity': {'id': '10053653751', 'name': 'Premier League'}}, {'domain': {'id': '6', 'name': 'Sports Event'}, 'entity': {'id': '1847793679592738816', 'name': 'Manchester City vs Nottingham Forest'}}, {'domain': {'id': '10', 'name': 'Person', 'description': 'Named people in the world like Nelson Mandela'}, 'entity': {'id': '1303663877104705536', 'name': 'Fabrizio Romano'}}, {'domain': {'id': '11', 'name': 'Sport', 'description': 'Types of sports, like soccer and basketball'}, 'entity': {'id': '733756536430809088', 'name': 'Soccer'}}, {'domain': {'id': '26', 'name': 'Sports League', 'description': ''}, 'entity': {'id': '731226211804794880', 'name': 'England - Soccer'}}, {'domain': {'id': '26', 'name': 'Sports League', 'description': ''}, 'entity': {'id': '733756526872006656', 'name': 'Premier League'}}, {'domain': {'id': '29', 'name': 'Events [Entity Service]', 'description': 'Real world events. '}, 'entity': {'id': '1847793679592738816', 'name': 'Manchester City vs Nottingham Forest'}}, {'domain': {'id': '43', 'name': 'Soccer Match', 'description': 'Sports Event specific to Soccer matches'}, 'entity': {'id': '1847793679592738816', 'name': 'Manchester City vs Nottingham Forest'}}, {'domain': {'id': '46', 'name': 'Business Taxonomy', 'description': 'Categories within Brand Verticals that narrow down the scope of Brands'}, 'entity': {'id': '1557697289971322880', 'name': 'Sports & Fitness Business', 'description': 'Brands, companies, advertisers and every non-person handle with the profit intent related to sports nutrition, athletic apparel, sports apps, fitness venues'}}, {'domain': {'id': '94', 'name': 'Journalist', 'description': ""A journalist like 'Anderson Cooper'""}, 'entity': {'id': '1303663877104705536', 'name': 'Fabrizio Romano'}}, {'domain': {'id': '131', 'name': 'Unified Twitter Taxonomy', 'description': 'A taxonomy of user interests. '}, 'entity': {'id': '733756526872006656', 'name': 'Premier League'}}, {'domain': {'id': '131', 'name': 'Unified Twitter Taxonomy', 'description': 'A taxonomy of user interests. '}, 'entity': {'id': '733756536430809088', 'name': 'Soccer'}}, {'domain': {'id': '131', 'name': 'Unified Twitter Taxonomy', 'description': 'A taxonomy of user interests. '}, 'entity': {'id': '847900493514891265', 'name': 'Sports', 'description': 'Sports'}}, {'domain': {'id': '131', 'name': 'Unified Twitter Taxonomy', 'description': 'A taxonomy of user interests. '}, 'entity': {'id': '1074755059433463813', 'name': 'Sports journalists', 'description': 'Sports Figures'}}, {'domain': {'id': '131', 'name': 'Unified Twitter Taxonomy', 'description': 'A taxonomy of user interests. '}, 'entity': {'id': '1303663877104705536', 'name': 'Fabrizio Romano'}}, {'domain': {'id': '10', 'name': 'Person', 'description': 'Named people in the world like Nelson Mandela'}, 'entity': {'id': '733774535133028352', 'name': 'Pep Guardiola'}}, {'domain': {'id': '11', 'name': 'Sport', 'description': 'Types of sports, like soccer and basketball'}, 'entity': {'id': '733756536430809088', 'name': 'Soccer'}}, {'domain': {'id': '12', 'name': 'Sports Team', 'description': 'A sports team organization, like Arsenal and the Boston Celtics'}, 'entity': {'id': '731226203856637952', 'name': 'Manchester City'}}, {'domain': {'id': '93', 'name': 'Coach', 'description': ""A Coach like 'Bill Belichick'""}, 'entity': {'id': '733774535133028352', 'name': 'Pep Guardiola'}}, {'domain': {'id': '131', 'name': 'Unified Twitter Taxonomy', 'description': 'A taxonomy of user interests. '}, 'entity': {'id': '731226203856637952', 'name': 'Manchester City'}}, {'domain': {'id': '131', 'name': 'Unified Twitter Taxonomy', 'description': 'A taxonomy of user interests. '}, 'entity': {'id': '733756536430809088', 'name': 'Soccer'}}, {'domain': {'id': '131', 'name': 'Unified Twitter Taxonomy', 'description': 'A taxonomy of user interests. '}, 'entity': {'id': '733774535133028352', 'name': 'Pep Guardiola'}}, {'domain': {'id': '131', 'name': 'Unified Twitter Taxonomy', 'description': 'A taxonomy of user interests. '}, 'entity': {'id': '847900493514891265', 'name': 'Sports', 'description': 'Sports'}}, {'domain': {'id': '131', 'name': 'Unified Twitter Taxonomy', 'description': 'A taxonomy of user interests. '}, 'entity': {'id': '1285942425861545984', 'name': 'Sports figures'}}, {'domain': {'id': '29', 'name': 'Events [Entity Service]', 'description': 'Real world events. '}, 'entity': {'id': '733756526872006656', 'name': 'Premier League'}}]"
"#PepGuardiola has had a lot of success particularly at #ManchesterCity, but most of his success has been backed by money and having established squads, but how does his success compare to other managers? #MCFC #Podcasts

 https://t.co/ETwqjAkFbf",2024-12-03 22:50:06,"[{'domain': {'id': '3', 'name': 'TV Shows', 'description': 'Television shows from around the world'}, 'entity': {'id': '10053653751', 'name': 'Premier League'}}, {'domain': {'id': '6', 'name': 'Sports Event'}, 'entity': {'id': '1847793679592738816', 'name': 'Manchester City vs Nottingham Forest'}}, {'domain': {'id': '11', 'name': 'Sport', 'description': 'Types of sports, like soccer and basketball'}, 'entity': {'id': '733756536430809088', 'name': 'Soccer'}}, {'domain': {'id': '26', 'name': 'Sports League', 'description': ''}, 'entity': {'id': '731226211804794880', 'name': 'England - Soccer'}}, {'domain': {'id': '26', 'name': 'Sports League', 'description': ''}, 'entity': {'id': '733756526872006656', 'name': 'Premier League'}}, {'domain': {'id': '29', 'name': 'Events [Entity Service]', 'description': 'Real world events. '}, 'entity': {'id': '1847793679592738816', 'name': 'Manchester City vs Nottingham Forest'}}, {'domain': {'id': '43', 'name': 'Soccer Match', 'description': 'Sports Event specific to Soccer matches'}, 'entity': {'id': '1847793679592738816', 'name': 'Manchester City vs Nottingham Forest'}}, {'domain': {'id': '46', 'name': 'Business Taxonomy', 'description': 'Categories within Brand Verticals that narrow down the scope of Brands'}, 'entity': {'id': '1557696802391859201', 'name': 'Entertainment & Leisure Business', 'description': 'Brands, companies, advertisers and every non-person handle with the profit intent related to movies, music, television, franchises, venues, theme parks, toys, tourism, hotels'}}, {'domain': {'id': '46', 'name': 'Business Taxonomy', 'description': 'Categories within Brand Verticals that narrow down the scope of Brands'}, 'entity': {'id': '1557697289971322880', 'name': 'Sports & Fitness Business', 'description': 'Brands, companies, advertisers and every non-person handle with the profit intent related to sports nutrition, athletic apparel, sports apps, fitness venues'}}, {'domain': {'id': '91', 'name': 'Podcast', 'description': 'A podcast like ""Serial""'}, 'entity': {'id': '1490751295698837510', 'name': 'Podcasts'}}, {'domain': {'id': '131', 'name': 'Unified Twitter Taxonomy', 'description': 'A taxonomy of user interests. '}, 'entity': {'id': '733756526872006656', 'name': 'Premier League'}}, {'domain': {'id': '131', 'name': 'Unified Twitter Taxonomy', 'description': 'A taxonomy of user interests. '}, 'entity': {'id': '733756536430809088', 'name': 'Soccer'}}, {'domain': {'id': '131', 'name': 'Unified Twitter Taxonomy', 'description': 'A taxonomy of user interests. '}, 'entity': {'id': '839544274442051584', 'name': 'Entertainment'}}, {'domain': {'id': '131', 'name': 'Unified Twitter Taxonomy', 'description': 'A taxonomy of user interests. '}, 'entity': {'id': '847900493514891265', 'name': 'Sports', 'description': 'Sports'}}, {'domain': {'id': '131', 'name': 'Unified Twitter Taxonomy', 'description': 'A taxonomy of user interests. '}, 'entity': {'id': '1074758954444513282', 'name': 'Podcasts & radio', 'description': 'Podcasts'}}, {'domain': {'id': '131', 'name': 'Unified Twitter Taxonomy', 'description': 'A taxonomy of user interests. '}, 'entity': {'id': '1490751295698837510', 'name': 'Podcasts'}}, {'domain': {'id': '10', 'name': 'Person', 'description': 'Named people in the world like Nelson Mandela'}, 'entity': {'id': '733774535133028352', 'name': 'Pep Guardiola'}}, {'domain': {'id': '11', 'name': 'Sport', 'description': 'Types of sports, like soccer and basketball'}, 'entity': {'id': '733756536430809088', 'name': 'Soccer'}}, {'domain': {'id': '12', 'name': 'Sports Team', 'description': 'A sports team organization, like Arsenal and the Boston Celtics'}, 'entity': {'id': '731226203856637952', 'name': 'Manchester City'}}, {'domain': {'id': '93', 'name': 'Coach', 'description': ""A Coach like 'Bill Belichick'""}, 'entity': {'id': '733774535133028352', 'name': 'Pep Guardiola'}}, {'domain': {'id': '131', 'name': 'Unified Twitter Taxonomy', 'description': 'A taxonomy of user interests. '}, 'entity': {'id': '731226203856637952', 'name': 'Manchester City'}}, {'domain': {'id': '131', 'name': 'Unified Twitter Taxonomy', 'description': 'A taxonomy of user interests. '}, 'entity': {'id': '733756536430809088', 'name': 'Soccer'}}, {'domain': {'id': '131', 'name': 'Unified Twitter Taxonomy', 'description': 'A taxonomy of user interests. '}, 'entity': {'id': '733774535133028352', 'name': 'Pep Guardiola'}}, {'domain': {'id': '131', 'name': 'Unified Twitter Taxonomy', 'description': 'A taxonomy of user interests. '}, 'entity': {'id': '847900493514891265', 'name': 'Sports', 'description': 'Sports'}}, {'domain': {'id': '131', 'name': 'Unified Twitter Taxonomy', 'description': 'A taxonomy of user interests. '}, 'entity': {'id': '1285942425861545984', 'name': 'Sports figures'}}, {'domain': {'id': '29', 'name': 'Events [Entity Service]', 'description': 'Real world events. '}, 'entity': {'id': '733756526872006656', 'name': 'Premier League'}}]"
"Pep’s teams suffocate the life out of you when they are on it and don’t let you out of your own half. Complete and utter domination sucking away any belief out of their opponent

https://t.co/zoAbT8ashq

#fyp #PremierLeague #manchestercity #pepguardiola #football https://t.co/kZ9GyUhZQT",2024-12-03 22:19:52,"[{'domain': {'id': '3', 'name': 'TV Shows', 'description': 'Television shows from around the world'}, 'entity': {'id': '10000277815', 'name': 'English Premier League Soccer', 'description': 'Action from English Premier League Soccer matches.'}}, {'domain': {'id': '3', 'name': 'TV Shows', 'description': 'Television shows from around the world'}, 'entity': {'id': '10027427957', 'name': 'Barclays Premier League Football', 'description': 'Live football coverage of a match from the Premier League.'}}, {'domain': {'id': '3', 'name': 'TV Shows', 'description': 'Television shows from around the world'}, 'entity': {'id': '10029304591', 'name': 'Barclays Premier League Soccer'}}, {'domain': {'id': '3', 'name': 'TV Shows', 'description': 'Television shows from around the world'}, 'entity': {'id': '10053653751', 'name': 'Premier League'}}, {'domain': {'id': '6', 'name': 'Sports Event'}, 'entity': {'id': '1847793679592738816', 'name': 'Manchester City vs Nottingham Forest'}}, {'domain': {'id': '11', 'name': 'Sport', 'description': 'Types of sports, like soccer and basketball'}, 'entity': {'id': '733756536430809088', 'name': 'Soccer'}}, {'domain': {'id': '26', 'name': 'Sports League', 'description': ''}, 'entity': {'id': '731226211804794880', 'name': 'England - Soccer'}}, {'domain': {'id': '26', 'name': 'Sports League', 'description': ''}, 'entity': {'id': '733756526872006656', 'name': 'Premier League'}}, {'domain': {'id': '29', 'name': 'Events [Entity Service]', 'description': 'Real world events. '}, 'entity': {'id': '1847793679592738816', 'name': 'Manchester City vs Nottingham Forest'}}, {'domain': {'id': '43', 'name': 'Soccer Match', 'description': 'Sports Event specific to Soccer matches'}, 'entity': {'id': '1847793679592738816', 'name': 'Manchester City vs Nottingham Forest'}}, {'domain': {'id': '46', 'name': 'Business Taxonomy', 'description': 'Categories within Brand Verticals that narrow down the scope of Brands'}, 'entity': {'id': '1557697289971322880', 'name': 'Sports & Fitness Business', 'description': 'Brands, companies, advertisers and every non-person handle with the profit intent related to sports nutrition, athletic apparel, sports apps, fitness venues'}}, {'domain': {'id': '131', 'name': 'Unified Twitter Taxonomy', 'description': 'A taxonomy of user interests. '}, 'entity': {'id': '733756526872006656', 'name': 'Premier League'}}, {'domain': {'id': '131', 'name': 'Unified Twitter Taxonomy', 'description': 'A taxonomy of user interests. '}, 'entity': {'id': '733756536430809088', 'name': 'Soccer'}}, {'domain': {'id': '131', 'name': 'Unified Twitter Taxonomy', 'description': 'A taxonomy of user interests. '}, 'entity': {'id': '847900493514891265', 'name': 'Sports', 'description': 'Sports'}}, {'domain': {'id': '10', 'name': 'Person', 'description': 'Named people in the world like Nelson Mandela'}, 'entity': {'id': '733774535133028352', 'name': 'Pep Guardiola'}}, {'domain': {'id': '11', 'name': 'Sport', 'description': 'Types of sports, like soccer and basketball'}, 'entity': {'id': '733756536430809088', 'name': 'Soccer'}}, {'domain': {'id': '12', 'name': 'Sports Team', 'description': 'A sports team organization, like Arsenal and the Boston Celtics'}, 'entity': {'id': '731226203856637952', 'name': 'Manchester City'}}, {'domain': {'id': '93', 'name': 'Coach', 'description': ""A Coach like 'Bill Belichick'""}, 'entity': {'id': '733774535133028352', 'name': 'Pep Guardiola'}}, {'domain': {'id': '131', 'name': 'Unified Twitter Taxonomy', 'description': 'A taxonomy of user interests. '}, 'entity': {'id': '731226203856637952', 'name': 'Manchester City'}}, {'domain': {'id': '131', 'name': 'Unified Twitter Taxonomy', 'description': 'A taxonomy of user interests. '}, 'entity': {'id': '733756536430809088', 'name': 'Soccer'}}, {'domain': {'id': '131', 'name': 'Unified Twitter Taxonomy', 'description': 'A taxonomy of user interests. '}, 'entity': {'id': '733774535133028352', 'name': 'Pep Guardiola'}}, {'domain': {'id': '131', 'name': 'Unified Twitter Taxonomy', 'description': 'A taxonomy of user interests. '}, 'entity': {'id': '847900493514891265', 'name': 'Sports', 'description': 'Sports'}}, {'domain': {'id': '131', 'name': 'Unified Twitter Taxonomy', 'description': 'A taxonomy of user interests. '}, 'entity': {'id': '1285942425861545984', 'name': 'Sports figures'}}, {'domain': {'id': '29', 'name': 'Events [Entity Service]', 'description': 'Real world events. '}, 'entity': {'id': '733756526872006656', 'name': 'Premier League'}}]"
