text,created_at,context_annotations
"Guardiola WANTS TO REBUILD Man City 🇪🇸 #premierleague #mancity https://t.co/GOx0DbZvgL via @YouTube
@premierleague @ManCity #FootballCoach #footballmanager #FootballNews #FootballUpdate #PepGuardiola #PremierLeague #ManchesterCity #ManCity https://t.co/jeTkfvALeY",2024-12-03 14:44:06,"[{'domain': {'id': '3', 'name': 'TV Shows', 'description': 'Television shows from around the world'}, 'entity': {'id': '10000277815', 'name': 'English Premier League Soccer', 'description': 'Action from English Premier League Soccer matches.'}}, {'domain': {'id': '3', 'name': 'TV Shows', 'description': 'Television shows from around the world'}, 'entity': {'id': '10027427957', 'name': 'Barclays Premier League Football', 'description': 'Live football coverage of a match from the Premier League.'}}, {'domain': {'id': '3', 'name': 'TV Shows', 'description': 'Television shows from around the world'}, 'entity': {'id': '10029304591', 'name': 'Barclays Premier League Soccer'}}, {'domain': {'id': '3', 'name': 'TV Shows', 'description': 'Television shows from around the world'}, 'entity': {'id': '10053653751', 'name': 'Premier League'}}, {'domain': {'id': '11', 'name': 'Sport', 'description': 'Types of sports, like soccer and basketball'}, 'entity': {'id': '733756536430809088', 'name': 'Soccer'}}, {'domain': {'id': '26', 'name': 'Sports League', 'description': ''}, 'entity': {'id': '733756526872006656', 'name': 'Premier League'}}, {'domain': {'id': '46', 'name': 'Business Taxonomy', 'description': 'Categories within Brand Verticals that narrow down the scope of Brands'}, 'entity': {'id': '1557696940178935808', 'name': 'Gaming Business', 'description': 'Brands, companies, advertisers and every non-person handle with the profit intent related to offline and online games such as gaming consoles, tabletop games, video game publishers'}}, {'domain': {'id': '46', 'name': 'Business Taxonomy', 'description': 'Categories within Brand Verticals that narrow down the scope of Brands'}, 'entity': {'id': '1557697289971322880', 'name': 'Sports & Fitness Business', 'description': 'Brands, companies, advertisers and every non-person handle with the profit intent related to sports nutrition, athletic apparel, sports apps, fitness venues'}}, {'domain': {'id': '71', 'name': 'Video Game', 'description': 'A video game like Overwatch'}, 'entity': {'id': '1263430865079554048', 'name': 'Football Manager'}}, {'domain': {'id': '131', 'name': 'Unified Twitter Taxonomy', 'description': 'A taxonomy of user interests. '}, 'entity': {'id': '733756526872006656', 'name': 'Premier League'}}, {'domain': {'id': '131', 'name': 'Unified Twitter Taxonomy', 'description': 'A taxonomy of user interests. '}, 'entity': {'id': '733756536430809088', 'name': 'Soccer'}}, {'domain': {'id': '131', 'name': 'Unified Twitter Taxonomy', 'description': 'A taxonomy of user interests. '}, 'entity': {'id': '847527650667094017', 'name': 'Gaming', 'description': 'Gaming'}}, {'domain': {'id': '131', 'name': 'Unified Twitter Taxonomy', 'description': 'A taxonomy of user interests. '}, 'entity': {'id': '847900493514891265', 'name': 'Sports', 'description': 'Sports'}}, {'domain': {'id': '131', 'name': 'Unified Twitter Taxonomy', 'description': 'A taxonomy of user interests. '}, 'entity': {'id': '1070028159964262400', 'name': 'Video games'}}, {'domain': {'id': '131', 'name': 'Unified Twitter Taxonomy', 'description': 'A taxonomy of user interests. '}, 'entity': {'id': '1263430865079554048', 'name': 'Football Manager'}}, {'domain': {'id': '131', 'name': 'Unified Twitter Taxonomy', 'description': 'A taxonomy of user interests. '}, 'entity': {'id': '1491898362609631238', 'name': 'Sports games'}}, {'domain': {'id': '10', 'name': 'Person', 'description': 'Named people in the world like Nelson Mandela'}, 'entity': {'id': '733774535133028352', 'name': 'Pep Guardiola'}}, {'domain': {'id': '11', 'name': 'Sport', 'description': 'Types of sports, like soccer and basketball'}, 'entity': {'id': '733756536430809088', 'name': 'Soccer'}}, {'domain': {'id': '12', 'name': 'Sports Team', 'description': 'A sports team organization, like Arsenal and the Boston Celtics'}, 'entity': {'id': '731226203856637952', 'name': 'Manchester City'}}, {'domain': {'id': '93', 'name': 'Coach', 'description': ""A Coach like 'Bill Belichick'""}, 'entity': {'id': '733774535133028352', 'name': 'Pep Guardiola'}}, {'domain': {'id': '131', 'name': 'Unified Twitter Taxonomy', 'description': 'A taxonomy of user interests. '}, 'entity': {'id': '731226203856637952', 'name': 'Manchester City'}}, {'domain': {'id': '131', 'name': 'Unified Twitter Taxonomy', 'description': 'A taxonomy of user interests. '}, 'entity': {'id': '733756536430809088', 'name': 'Soccer'}}, {'domain': {'id': '131', 'name': 'Unified Twitter Taxonomy', 'description': 'A taxonomy of user interests. '}, 'entity': {'id': '733774535133028352', 'name': 'Pep Guardiola'}}, {'domain': {'id': '131', 'name': 'Unified Twitter Taxonomy', 'description': 'A taxonomy of user interests. '}, 'entity': {'id': '847900493514891265', 'name': 'Sports', 'description': 'Sports'}}, {'domain': {'id': '131', 'name': 'Unified Twitter Taxonomy', 'description': 'A taxonomy of user interests. '}, 'entity': {'id': '1285942425861545984', 'name': 'Sports figures'}}]"
"""I think he's a generational talent going to waste at Man City."" 😨 https://t.co/xdBocangrx #JackGrealish #PepGuardiola",2024-12-03 14:23:09,"[{'domain': {'id': '10', 'name': 'Person', 'description': 'Named people in the world like Nelson Mandela'}, 'entity': {'id': '733774810828791808', 'name': 'Jack Grealish'}}, {'domain': {'id': '46', 'name': 'Business Taxonomy', 'description': 'Categories within Brand Verticals that narrow down the scope of Brands'}, 'entity': {'id': '1557697289971322880', 'name': 'Sports & Fitness Business', 'description': 'Brands, companies, advertisers and every non-person handle with the profit intent related to sports nutrition, athletic apparel, sports apps, fitness venues'}}, {'domain': {'id': '60', 'name': 'Athlete', 'description': 'An athlete in the world, like Serena Williams or Lionel Messi'}, 'entity': {'id': '733774810828791808', 'name': 'Jack Grealish'}}, {'domain': {'id': '131', 'name': 'Unified Twitter Taxonomy', 'description': 'A taxonomy of user interests. '}, 'entity': {'id': '733756536430809088', 'name': 'Soccer'}}, {'domain': {'id': '131', 'name': 'Unified Twitter Taxonomy', 'description': 'A taxonomy of user interests. '}, 'entity': {'id': '733774810828791808', 'name': 'Jack Grealish'}}, {'domain': {'id': '131', 'name': 'Unified Twitter Taxonomy', 'description': 'A taxonomy of user interests. '}, 'entity': {'id': '847900493514891265', 'name': 'Sports', 'description': 'Sports'}}, {'domain': {'id': '10', 'name': 'Person', 'description': 'Named people in the world like Nelson Mandela'}, 'entity': {'id': '733774535133028352', 'name': 'Pep Guardiola'}}, {'domain': {'id': '11', 'name': 'Sport', 'description': 'Types of sports, like soccer and basketball'}, 'entity': {'id': '733756536430809088', 'name': 'Soccer'}}, {'domain': {'id': '12', 'name': 'Sports Team', 'description': 'A sports team organization, like Arsenal and the Boston Celtics'}, 'entity': {'id': '731226203856637952', 'name': 'Manchester City'}}, {'domain': {'id': '93', 'name': 'Coach', 'description': ""A Coach like 'Bill Belichick'""}, 'entity': {'id': '733774535133028352', 'name': 'Pep Guardiola'}}, {'domain': {'id': '131', 'name': 'Unified Twitter Taxonomy', 'description': 'A taxonomy of user interests. '}, 'entity': {'id': '731226203856637952', 'name': 'Manchester City'}}, {'domain': {'id': '131', 'name': 'Unified Twitter Taxonomy', 'description': 'A taxonomy of user interests. '}, 'entity': {'id': '733756536430809088', 'name': 'Soccer'}}, {'domain': {'id': '131', 'name': 'Unified Twitter Taxonomy', 'description': 'A taxonomy of user interests. '}, 'entity': {'id': '733774535133028352', 'name': 'Pep Guardiola'}}, {'domain': {'id': '131', 'name': 'Unified Twitter Taxonomy', 'description': 'A taxonomy of user interests. '}, 'entity': {'id': '847900493514891265', 'name': 'Sports', 'description': 'Sports'}}, {'domain': {'id': '131', 'name': 'Unified Twitter Taxonomy', 'description': 'A taxonomy of user interests. '}, 'entity': {'id': '1285942425861545984', 'name': 'Sports figures'}}]"
"“WE HAVE TO ACCEPT IT,” SAYS PEP GUARDIOLA. 🔹

The Manchester City boss reflects on staying grounded during tough times.

#ManCity | #PepGuardiola | #Football

https://t.co/fVElV9LVF6",2024-12-03 14:15:00,"[{'domain': {'id': '11', 'name': 'Sport', 'description': 'Types of sports, like soccer and basketball'}, 'entity': {'id': '733756536430809088', 'name': 'Soccer'}}, {'domain': {'id': '46', 'name': 'Business Taxonomy', 'description': 'Categories within Brand Verticals that narrow down the scope of Brands'}, 'entity': {'id': '1557697289971322880', 'name': 'Sports & Fitness Business', 'description': 'Brands, companies, advertisers and every non-person handle with the profit intent related to sports nutrition, athletic apparel, sports apps, fitness venues'}}, {'domain': {'id': '131', 'name': 'Unified Twitter Taxonomy', 'description': 'A taxonomy of user interests. '}, 'entity': {'id': '733756536430809088', 'name': 'Soccer'}}, {'domain': {'id': '131', 'name': 'Unified Twitter Taxonomy', 'description': 'A taxonomy of user interests. '}, 'entity': {'id': '847900493514891265', 'name': 'Sports', 'description': 'Sports'}}, {'domain': {'id': '10', 'name': 'Person', 'description': 'Named people in the world like Nelson Mandela'}, 'entity': {'id': '733774535133028352', 'name': 'Pep Guardiola'}}, {'domain': {'id': '11', 'name': 'Sport', 'description': 'Types of sports, like soccer and basketball'}, 'entity': {'id': '733756536430809088', 'name': 'Soccer'}}, {'domain': {'id': '12', 'name': 'Sports Team', 'description': 'A sports team organization, like Arsenal and the Boston Celtics'}, 'entity': {'id': '731226203856637952', 'name': 'Manchester City'}}, {'domain': {'id': '93', 'name': 'Coach', 'description': ""A Coach like 'Bill Belichick'""}, 'entity': {'id': '733774535133028352', 'name': 'Pep Guardiola'}}, {'domain': {'id': '131', 'name': 'Unified Twitter Taxonomy', 'description': 'A taxonomy of user interests. '}, 'entity': {'id': '731226203856637952', 'name': 'Manchester City'}}, {'domain': {'id': '131', 'name': 'Unified Twitter Taxonomy', 'description': 'A taxonomy of user interests. '}, 'entity': {'id': '733756536430809088', 'name': 'Soccer'}}, {'domain': {'id': '131', 'name': 'Unified Twitter Taxonomy', 'description': 'A taxonomy of user interests. '}, 'entity': {'id': '733774535133028352', 'name': 'Pep Guardiola'}}, {'domain': {'id': '131', 'name': 'Unified Twitter Taxonomy', 'description': 'A taxonomy of user interests. '}, 'entity': {'id': '847900493514891265', 'name': 'Sports', 'description': 'Sports'}}, {'domain': {'id': '131', 'name': 'Unified Twitter Taxonomy', 'description': 'A taxonomy of user interests. '}, 'entity': {'id': '1285942425861545984', 'name': 'Sports figures'}}]"
"Feel for him❤🥺

#PepGuardiola #ManCity https://t.co/7BbVX5Rc1q",2024-12-03 14:11:08,"[{'domain': {'id': '46', 'name': 'Business Taxonomy', 'description': 'Categories within Brand Verticals that narrow down the scope of Brands'}, 'entity': {'id': '1557697289971322880', 'name': 'Sports & Fitness Business', 'description': 'Brands, companies, advertisers and every non-person handle with the profit intent related to sports nutrition, athletic apparel, sports apps, fitness venues'}}, {'domain': {'id': '10', 'name': 'Person', 'description': 'Named people in the world like Nelson Mandela'}, 'entity': {'id': '733774535133028352', 'name': 'Pep Guardiola'}}, {'domain': {'id': '11', 'name': 'Sport', 'description': 'Types of sports, like soccer and basketball'}, 'entity': {'id': '733756536430809088', 'name': 'Soccer'}}, {'domain': {'id': '12', 'name': 'Sports Team', 'description': 'A sports team organization, like Arsenal and the Boston Celtics'}, 'entity': {'id': '731226203856637952', 'name': 'Manchester City'}}, {'domain': {'id': '93', 'name': 'Coach', 'description': ""A Coach like 'Bill Belichick'""}, 'entity': {'id': '733774535133028352', 'name': 'Pep Guardiola'}}, {'domain': {'id': '131', 'name': 'Unified Twitter Taxonomy', 'description': 'A taxonomy of user interests. '}, 'entity': {'id': '731226203856637952', 'name': 'Manchester City'}}, {'domain': {'id': '131', 'name': 'Unified Twitter Taxonomy', 'description': 'A taxonomy of user interests. '}, 'entity': {'id': '733756536430809088', 'name': 'Soccer'}}, {'domain': {'id': '131', 'name': 'Unified Twitter Taxonomy', 'description': 'A taxonomy of user interests. '}, 'entity': {'id': '733774535133028352', 'name': 'Pep Guardiola'}}, {'domain': {'id': '131', 'name': 'Unified Twitter Taxonomy', 'description': 'A taxonomy of user interests. '}, 'entity': {'id': '847900493514891265', 'name': 'Sports', 'description': 'Sports'}}, {'domain': {'id': '131', 'name': 'Unified Twitter Taxonomy', 'description': 'A taxonomy of user interests. '}, 'entity': {'id': '1285942425861545984', 'name': 'Sports figures'}}]"
"@FabrizioRomano @City_Xtra Pep Guardiola on Man City’s winter transfer plans: ""We will talk in January. It depends on the position of the squad at that moment..."" 🧐⚽ #ManCity #PepGuardiola",2024-12-03 13:54:18,"[{'domain': {'id': '10', 'name': 'Person', 'description': 'Named people in the world like Nelson Mandela'}, 'entity': {'id': '1303663877104705536', 'name': 'Fabrizio Romano'}}, {'domain': {'id': '46', 'name': 'Business Taxonomy', 'description': 'Categories within Brand Verticals that narrow down the scope of Brands'}, 'entity': {'id': '1557697289971322880', 'name': 'Sports & Fitness Business', 'description': 'Brands, companies, advertisers and every non-person handle with the profit intent related to sports nutrition, athletic apparel, sports apps, fitness venues'}}, {'domain': {'id': '94', 'name': 'Journalist', 'description': ""A journalist like 'Anderson Cooper'""}, 'entity': {'id': '1303663877104705536', 'name': 'Fabrizio Romano'}}, {'domain': {'id': '131', 'name': 'Unified Twitter Taxonomy', 'description': 'A taxonomy of user interests. '}, 'entity': {'id': '733756536430809088', 'name': 'Soccer'}}, {'domain': {'id': '131', 'name': 'Unified Twitter Taxonomy', 'description': 'A taxonomy of user interests. '}, 'entity': {'id': '847900493514891265', 'name': 'Sports', 'description': 'Sports'}}, {'domain': {'id': '131', 'name': 'Unified Twitter Taxonomy', 'description': 'A taxonomy of user interests. '}, 'entity': {'id': '1074755059433463813', 'name': 'Sports journalists', 'description': 'Sports Figures'}}, {'domain': {'id': '131', 'name': 'Unified Twitter Taxonomy', 'description': 'A taxonomy of user interests. '}, 'entity': {'id': '1303663877104705536', 'name': 'Fabrizio Romano'}}, {'domain': {'id': '10', 'name': 'Person', 'description': 'Named people in the world like Nelson Mandela'}, 'entity': {'id': '733774535133028352', 'name': 'Pep Guardiola'}}, {'domain': {'id': '11', 'name': 'Sport', 'description': 'Types of sports, like soccer and basketball'}, 'entity': {'id': '733756536430809088', 'name': 'Soccer'}}, {'domain': {'id': '12', 'name': 'Sports Team', 'description': 'A sports team organization, like Arsenal and the Boston Celtics'}, 'entity': {'id': '731226203856637952', 'name': 'Manchester City'}}, {'domain': {'id': '93', 'name': 'Coach', 'description': ""A Coach like 'Bill Belichick'""}, 'entity': {'id': '733774535133028352', 'name': 'Pep Guardiola'}}, {'domain': {'id': '131', 'name': 'Unified Twitter Taxonomy', 'description': 'A taxonomy of user interests. '}, 'entity': {'id': '731226203856637952', 'name': 'Manchester City'}}, {'domain': {'id': '131', 'name': 'Unified Twitter Taxonomy', 'description': 'A taxonomy of user interests. '}, 'entity': {'id': '733756536430809088', 'name': 'Soccer'}}, {'domain': {'id': '131', 'name': 'Unified Twitter Taxonomy', 'description': 'A taxonomy of user interests. '}, 'entity': {'id': '733774535133028352', 'name': 'Pep Guardiola'}}, {'domain': {'id': '131', 'name': 'Unified Twitter Taxonomy', 'description': 'A taxonomy of user interests. '}, 'entity': {'id': '847900493514891265', 'name': 'Sports', 'description': 'Sports'}}, {'domain': {'id': '131', 'name': 'Unified Twitter Taxonomy', 'description': 'A taxonomy of user interests. '}, 'entity': {'id': '1285942425861545984', 'name': 'Sports figures'}}]"
"One broke boy is working so hard right now to surprise his cheating girlfriend this Christmas.

#Arsenal #MUFC #PepGuardiola #PRSKSummit2024 #RangersPassout2024 #Saka #Kofi #JerryJeudy #BoNix #stayhumble  #GrandeFratello #LGBTQ #Devki #Adani #Election2024",2024-12-03 13:39:48,"[{'domain': {'id': '10', 'name': 'Person', 'description': 'Named people in the world like Nelson Mandela'}, 'entity': {'id': '1068326513798373376', 'name': 'Bukayo Saka'}}, {'domain': {'id': '10', 'name': 'Person', 'description': 'Named people in the world like Nelson Mandela'}, 'entity': {'id': '1253592351043284996', 'name': 'Jerry Jeudy'}}, {'domain': {'id': '29', 'name': 'Events [Entity Service]', 'description': 'Real world events. '}, 'entity': {'id': '1665772587467653121', 'name': '2024 US Presidential Election', 'description': '2024 US Presidential Election'}}, {'domain': {'id': '29', 'name': 'Events [Entity Service]', 'description': 'Real world events. '}, 'entity': {'id': '1707176037577068544', 'name': '2nd US Republican Primary Debate 2024', 'description': '#GOPDebate is happening! Explore the latest Tweets, must-see highlights, and the can’t-miss moments right here.\n\n'}}, {'domain': {'id': '29', 'name': 'Events [Entity Service]', 'description': 'Real world events. '}, 'entity': {'id': '1722429172528611328', 'name': '3rd US Republican Primary Debate 2024', 'description': '#GOPDebate is happening! Explore the latest Tweets, must-see highlights, and the can’t-miss moments right here.\n\n'}}, {'domain': {'id': '29', 'name': 'Events [Entity Service]', 'description': 'Real world events. '}, 'entity': {'id': '1729551200817717248', 'name': '4th US Republican Primary Debate 2024', 'description': '#GOPDebate is happening! Explore the latest Tweets, must-see highlights, and the can’t-miss moments right here.\n\n'}}, {'domain': {'id': '29', 'name': 'Events [Entity Service]', 'description': 'Real world events. '}, 'entity': {'id': '1853510897634873344', 'name': 'Christmas 2024'}}, {'domain': {'id': '46', 'name': 'Business Taxonomy', 'description': 'Categories within Brand Verticals that narrow down the scope of Brands'}, 'entity': {'id': '1557697289971322880', 'name': 'Sports & Fitness Business', 'description': 'Brands, companies, advertisers and every non-person handle with the profit intent related to sports nutrition, athletic apparel, sports apps, fitness venues'}}, {'domain': {'id': '47', 'name': 'Brand', 'description': 'Brands and Companies'}, 'entity': {'id': '1418358396516851713', 'name': 'Ko-fi'}}, {'domain': {'id': '60', 'name': 'Athlete', 'description': 'An athlete in the world, like Serena Williams or Lionel Messi'}, 'entity': {'id': '1068326513798373376', 'name': 'Bukayo Saka'}}, {'domain': {'id': '60', 'name': 'Athlete', 'description': 'An athlete in the world, like Serena Williams or Lionel Messi'}, 'entity': {'id': '1253592351043284996', 'name': 'Jerry Jeudy'}}, {'domain': {'id': '119', 'name': 'Holiday', 'description': 'Holidays like Christmas or Halloween'}, 'entity': {'id': '1853510897634873344', 'name': 'Christmas 2024'}}, {'domain': {'id': '131', 'name': 'Unified Twitter Taxonomy', 'description': 'A taxonomy of user interests. '}, 'entity': {'id': '689566306014617600', 'name': 'American football'}}, {'domain': {'id': '131', 'name': 'Unified Twitter Taxonomy', 'description': 'A taxonomy of user interests. '}, 'entity': {'id': '689566314835259392', 'name': 'NFL'}}, {'domain': {'id': '131', 'name': 'Unified Twitter Taxonomy', 'description': 'A taxonomy of user interests. '}, 'entity': {'id': '733756536430809088', 'name': 'Soccer'}}, {'domain': {'id': '131', 'name': 'Unified Twitter Taxonomy', 'description': 'A taxonomy of user interests. '}, 'entity': {'id': '847548225712119808', 'name': 'Holidays', 'description': 'Holidays'}}, {'domain': {'id': '131', 'name': 'Unified Twitter Taxonomy', 'description': 'A taxonomy of user interests. '}, 'entity': {'id': '847878884917886977', 'name': 'Politics', 'description': 'Politics'}}, {'domain': {'id': '131', 'name': 'Unified Twitter Taxonomy', 'description': 'A taxonomy of user interests. '}, 'entity': {'id': '847900493514891265', 'name': 'Sports', 'description': 'Sports'}}, {'domain': {'id': '131', 'name': 'Unified Twitter Taxonomy', 'description': 'A taxonomy of user interests. '}, 'entity': {'id': '1068326513798373376', 'name': 'Bukayo Saka'}}, {'domain': {'id': '131', 'name': 'Unified Twitter Taxonomy', 'description': 'A taxonomy of user interests. '}, 'entity': {'id': '1253592351043284996', 'name': 'Jerry Jeudy'}}, {'domain': {'id': '131', 'name': 'Unified Twitter Taxonomy', 'description': 'A taxonomy of user interests. '}, 'entity': {'id': '1263187885970227200', 'name': 'NFL players'}}, {'domain': {'id': '131', 'name': 'Unified Twitter Taxonomy', 'description': 'A taxonomy of user interests. '}, 'entity': {'id': '1291447199595782144', 'name': 'United States politics'}}, {'domain': {'id': '131', 'name': 'Unified Twitter Taxonomy', 'description': 'A taxonomy of user interests. '}, 'entity': {'id': '1418358396516851713', 'name': 'Ko-fi'}}, {'domain': {'id': '131', 'name': 'Unified Twitter Taxonomy', 'description': 'A taxonomy of user interests. '}, 'entity': {'id': '1436053202835689485', 'name': 'Events'}}, {'domain': {'id': '131', 'name': 'Unified Twitter Taxonomy', 'description': 'A taxonomy of user interests. '}, 'entity': {'id': '1665772587467653121', 'name': '2024 US Presidential Election', 'description': '2024 US Presidential Election'}}, {'domain': {'id': '131', 'name': 'Unified Twitter Taxonomy', 'description': 'A taxonomy of user interests. '}, 'entity': {'id': '1853510897634873344', 'name': 'Christmas 2024'}}, {'domain': {'id': '10', 'name': 'Person', 'description': 'Named people in the world like Nelson Mandela'}, 'entity': {'id': '733774535133028352', 'name': 'Pep Guardiola'}}, {'domain': {'id': '11', 'name': 'Sport', 'description': 'Types of sports, like soccer and basketball'}, 'entity': {'id': '733756536430809088', 'name': 'Soccer'}}, {'domain': {'id': '12', 'name': 'Sports Team', 'description': 'A sports team organization, like Arsenal and the Boston Celtics'}, 'entity': {'id': '731226183572934657', 'name': 'Manchester United'}}, {'domain': {'id': '12', 'name': 'Sports Team', 'description': 'A sports team organization, like Arsenal and the Boston Celtics'}, 'entity': {'id': '731226241894752257', 'name': 'Arsenal'}}, {'domain': {'id': '93', 'name': 'Coach', 'description': ""A Coach like 'Bill Belichick'""}, 'entity': {'id': '733774535133028352', 'name': 'Pep Guardiola'}}, {'domain': {'id': '131', 'name': 'Unified Twitter Taxonomy', 'description': 'A taxonomy of user interests. '}, 'entity': {'id': '731226183572934657', 'name': 'Manchester United'}}, {'domain': {'id': '131', 'name': 'Unified Twitter Taxonomy', 'description': 'A taxonomy of user interests. '}, 'entity': {'id': '731226241894752257', 'name': 'Arsenal'}}, {'domain': {'id': '131', 'name': 'Unified Twitter Taxonomy', 'description': 'A taxonomy of user interests. '}, 'entity': {'id': '733756536430809088', 'name': 'Soccer'}}, {'domain': {'id': '131', 'name': 'Unified Twitter Taxonomy', 'description': 'A taxonomy of user interests. '}, 'entity': {'id': '733774535133028352', 'name': 'Pep Guardiola'}}, {'domain': {'id': '131', 'name': 'Unified Twitter Taxonomy', 'description': 'A taxonomy of user interests. '}, 'entity': {'id': '847900493514891265', 'name': 'Sports', 'description': 'Sports'}}, {'domain': {'id': '131', 'name': 'Unified Twitter Taxonomy', 'description': 'A taxonomy of user interests. '}, 'entity': {'id': '1285942425861545984', 'name': 'Sports figures'}}]"
