text,created_at,context_annotations
"In Arteta we trust, tomorrow they’ll 

#Arsenal #MUFC #PepGuardiola #PRSKSummit2024 #RangersPassout2024 #Saka #Kofi #JerryJeudy #BoNix #stayhumble  #GrandeFratello #LGBTQ https://t.co/fFCMpmSHFX",2024-12-03 12:25:56,"[{'domain': {'id': '10', 'name': 'Person', 'description': 'Named people in the world like Nelson Mandela'}, 'entity': {'id': '1068326513798373376', 'name': 'Bukayo Saka'}}, {'domain': {'id': '10', 'name': 'Person', 'description': 'Named people in the world like Nelson Mandela'}, 'entity': {'id': '1209038256643305472', 'name': 'Mikel Arteta'}}, {'domain': {'id': '10', 'name': 'Person', 'description': 'Named people in the world like Nelson Mandela'}, 'entity': {'id': '1253592351043284996', 'name': 'Jerry Jeudy'}}, {'domain': {'id': '46', 'name': 'Business Taxonomy', 'description': 'Categories within Brand Verticals that narrow down the scope of Brands'}, 'entity': {'id': '1557697289971322880', 'name': 'Sports & Fitness Business', 'description': 'Brands, companies, advertisers and every non-person handle with the profit intent related to sports nutrition, athletic apparel, sports apps, fitness venues'}}, {'domain': {'id': '47', 'name': 'Brand', 'description': 'Brands and Companies'}, 'entity': {'id': '1418358396516851713', 'name': 'Ko-fi'}}, {'domain': {'id': '60', 'name': 'Athlete', 'description': 'An athlete in the world, like Serena Williams or Lionel Messi'}, 'entity': {'id': '1068326513798373376', 'name': 'Bukayo Saka'}}, {'domain': {'id': '60', 'name': 'Athlete', 'description': 'An athlete in the world, like Serena Williams or Lionel Messi'}, 'entity': {'id': '1253592351043284996', 'name': 'Jerry Jeudy'}}, {'domain': {'id': '93', 'name': 'Coach', 'description': ""A Coach like 'Bill Belichick'""}, 'entity': {'id': '1209038256643305472', 'name': 'Mikel Arteta'}}, {'domain': {'id': '131', 'name': 'Unified Twitter Taxonomy', 'description': 'A taxonomy of user interests. '}, 'entity': {'id': '689566306014617600', 'name': 'American football'}}, {'domain': {'id': '131', 'name': 'Unified Twitter Taxonomy', 'description': 'A taxonomy of user interests. '}, 'entity': {'id': '689566314835259392', 'name': 'NFL'}}, {'domain': {'id': '131', 'name': 'Unified Twitter Taxonomy', 'description': 'A taxonomy of user interests. '}, 'entity': {'id': '733756536430809088', 'name': 'Soccer'}}, {'domain': {'id': '131', 'name': 'Unified Twitter Taxonomy', 'description': 'A taxonomy of user interests. '}, 'entity': {'id': '847900493514891265', 'name': 'Sports', 'description': 'Sports'}}, {'domain': {'id': '131', 'name': 'Unified Twitter Taxonomy', 'description': 'A taxonomy of user interests. '}, 'entity': {'id': '1068326513798373376', 'name': 'Bukayo Saka'}}, {'domain': {'id': '131', 'name': 'Unified Twitter Taxonomy', 'description': 'A taxonomy of user interests. '}, 'entity': {'id': '1209038256643305472', 'name': 'Mikel Arteta'}}, {'domain': {'id': '131', 'name': 'Unified Twitter Taxonomy', 'description': 'A taxonomy of user interests. '}, 'entity': {'id': '1253592351043284996', 'name': 'Jerry Jeudy'}}, {'domain': {'id': '131', 'name': 'Unified Twitter Taxonomy', 'description': 'A taxonomy of user interests. '}, 'entity': {'id': '1263187885970227200', 'name': 'NFL players'}}, {'domain': {'id': '131', 'name': 'Unified Twitter Taxonomy', 'description': 'A taxonomy of user interests. '}, 'entity': {'id': '1285942425861545984', 'name': 'Sports figures'}}, {'domain': {'id': '131', 'name': 'Unified Twitter Taxonomy', 'description': 'A taxonomy of user interests. '}, 'entity': {'id': '1418358396516851713', 'name': 'Ko-fi'}}, {'domain': {'id': '10', 'name': 'Person', 'description': 'Named people in the world like Nelson Mandela'}, 'entity': {'id': '733774047180247042', 'name': 'Mikel Arteta'}}, {'domain': {'id': '10', 'name': 'Person', 'description': 'Named people in the world like Nelson Mandela'}, 'entity': {'id': '733774535133028352', 'name': 'Pep Guardiola'}}, {'domain': {'id': '11', 'name': 'Sport', 'description': 'Types of sports, like soccer and basketball'}, 'entity': {'id': '733756536430809088', 'name': 'Soccer'}}, {'domain': {'id': '12', 'name': 'Sports Team', 'description': 'A sports team organization, like Arsenal and the Boston Celtics'}, 'entity': {'id': '731226183572934657', 'name': 'Manchester United'}}, {'domain': {'id': '12', 'name': 'Sports Team', 'description': 'A sports team organization, like Arsenal and the Boston Celtics'}, 'entity': {'id': '731226241894752257', 'name': 'Arsenal'}}, {'domain': {'id': '60', 'name': 'Athlete', 'description': 'An athlete in the world, like Serena Williams or Lionel Messi'}, 'entity': {'id': '733774047180247042', 'name': 'Mikel Arteta'}}, {'domain': {'id': '93', 'name': 'Coach', 'description': ""A Coach like 'Bill Belichick'""}, 'entity': {'id': '733774535133028352', 'name': 'Pep Guardiola'}}, {'domain': {'id': '131', 'name': 'Unified Twitter Taxonomy', 'description': 'A taxonomy of user interests. '}, 'entity': {'id': '731226183572934657', 'name': 'Manchester United'}}, {'domain': {'id': '131', 'name': 'Unified Twitter Taxonomy', 'description': 'A taxonomy of user interests. '}, 'entity': {'id': '731226241894752257', 'name': 'Arsenal'}}, {'domain': {'id': '131', 'name': 'Unified Twitter Taxonomy', 'description': 'A taxonomy of user interests. '}, 'entity': {'id': '733756536430809088', 'name': 'Soccer'}}, {'domain': {'id': '131', 'name': 'Unified Twitter Taxonomy', 'description': 'A taxonomy of user interests. '}, 'entity': {'id': '733774047180247042', 'name': 'Mikel Arteta'}}, {'domain': {'id': '131', 'name': 'Unified Twitter Taxonomy', 'description': 'A taxonomy of user interests. '}, 'entity': {'id': '733774535133028352', 'name': 'Pep Guardiola'}}, {'domain': {'id': '131', 'name': 'Unified Twitter Taxonomy', 'description': 'A taxonomy of user interests. '}, 'entity': {'id': '847900493514891265', 'name': 'Sports', 'description': 'Sports'}}, {'domain': {'id': '131', 'name': 'Unified Twitter Taxonomy', 'description': 'A taxonomy of user interests. '}, 'entity': {'id': '1285942425861545984', 'name': 'Sports figures'}}]"
Manchester City admit they have made a huge mistake ❌ https://t.co/E27AsVEn7W #PepGuardiola,2024-12-03 12:08:34,"[{'domain': {'id': '46', 'name': 'Business Taxonomy', 'description': 'Categories within Brand Verticals that narrow down the scope of Brands'}, 'entity': {'id': '1557697289971322880', 'name': 'Sports & Fitness Business', 'description': 'Brands, companies, advertisers and every non-person handle with the profit intent related to sports nutrition, athletic apparel, sports apps, fitness venues'}}, {'domain': {'id': '10', 'name': 'Person', 'description': 'Named people in the world like Nelson Mandela'}, 'entity': {'id': '733774535133028352', 'name': 'Pep Guardiola'}}, {'domain': {'id': '11', 'name': 'Sport', 'description': 'Types of sports, like soccer and basketball'}, 'entity': {'id': '733756536430809088', 'name': 'Soccer'}}, {'domain': {'id': '12', 'name': 'Sports Team', 'description': 'A sports team organization, like Arsenal and the Boston Celtics'}, 'entity': {'id': '731226203856637952', 'name': 'Manchester City'}}, {'domain': {'id': '93', 'name': 'Coach', 'description': ""A Coach like 'Bill Belichick'""}, 'entity': {'id': '733774535133028352', 'name': 'Pep Guardiola'}}, {'domain': {'id': '131', 'name': 'Unified Twitter Taxonomy', 'description': 'A taxonomy of user interests. '}, 'entity': {'id': '731226203856637952', 'name': 'Manchester City'}}, {'domain': {'id': '131', 'name': 'Unified Twitter Taxonomy', 'description': 'A taxonomy of user interests. '}, 'entity': {'id': '733756536430809088', 'name': 'Soccer'}}, {'domain': {'id': '131', 'name': 'Unified Twitter Taxonomy', 'description': 'A taxonomy of user interests. '}, 'entity': {'id': '733774535133028352', 'name': 'Pep Guardiola'}}, {'domain': {'id': '131', 'name': 'Unified Twitter Taxonomy', 'description': 'A taxonomy of user interests. '}, 'entity': {'id': '847900493514891265', 'name': 'Sports', 'description': 'Sports'}}, {'domain': {'id': '131', 'name': 'Unified Twitter Taxonomy', 'description': 'A taxonomy of user interests. '}, 'entity': {'id': '1285942425861545984', 'name': 'Sports figures'}}]"
"We’re putting everything on God’s hands; Manchester United will need all the prayers they can get

#Arsenal #MUFC #PepGuardiola #PRSKSummit2024 #RangersPassout2024 #Saka #Kofi #JerryJeudy #BoNix #stayhumble  #GrandeFratello #LGBTQ https://t.co/bRo8k1doQe",2024-12-03 12:03:56,"[{'domain': {'id': '10', 'name': 'Person', 'description': 'Named people in the world like Nelson Mandela'}, 'entity': {'id': '1068326513798373376', 'name': 'Bukayo Saka'}}, {'domain': {'id': '10', 'name': 'Person', 'description': 'Named people in the world like Nelson Mandela'}, 'entity': {'id': '1253592351043284996', 'name': 'Jerry Jeudy'}}, {'domain': {'id': '46', 'name': 'Business Taxonomy', 'description': 'Categories within Brand Verticals that narrow down the scope of Brands'}, 'entity': {'id': '1557697289971322880', 'name': 'Sports & Fitness Business', 'description': 'Brands, companies, advertisers and every non-person handle with the profit intent related to sports nutrition, athletic apparel, sports apps, fitness venues'}}, {'domain': {'id': '47', 'name': 'Brand', 'description': 'Brands and Companies'}, 'entity': {'id': '1418358396516851713', 'name': 'Ko-fi'}}, {'domain': {'id': '60', 'name': 'Athlete', 'description': 'An athlete in the world, like Serena Williams or Lionel Messi'}, 'entity': {'id': '1068326513798373376', 'name': 'Bukayo Saka'}}, {'domain': {'id': '60', 'name': 'Athlete', 'description': 'An athlete in the world, like Serena Williams or Lionel Messi'}, 'entity': {'id': '1253592351043284996', 'name': 'Jerry Jeudy'}}, {'domain': {'id': '131', 'name': 'Unified Twitter Taxonomy', 'description': 'A taxonomy of user interests. '}, 'entity': {'id': '689566306014617600', 'name': 'American football'}}, {'domain': {'id': '131', 'name': 'Unified Twitter Taxonomy', 'description': 'A taxonomy of user interests. '}, 'entity': {'id': '689566314835259392', 'name': 'NFL'}}, {'domain': {'id': '131', 'name': 'Unified Twitter Taxonomy', 'description': 'A taxonomy of user interests. '}, 'entity': {'id': '733756536430809088', 'name': 'Soccer'}}, {'domain': {'id': '131', 'name': 'Unified Twitter Taxonomy', 'description': 'A taxonomy of user interests. '}, 'entity': {'id': '847900493514891265', 'name': 'Sports', 'description': 'Sports'}}, {'domain': {'id': '131', 'name': 'Unified Twitter Taxonomy', 'description': 'A taxonomy of user interests. '}, 'entity': {'id': '1068326513798373376', 'name': 'Bukayo Saka'}}, {'domain': {'id': '131', 'name': 'Unified Twitter Taxonomy', 'description': 'A taxonomy of user interests. '}, 'entity': {'id': '1253592351043284996', 'name': 'Jerry Jeudy'}}, {'domain': {'id': '131', 'name': 'Unified Twitter Taxonomy', 'description': 'A taxonomy of user interests. '}, 'entity': {'id': '1263187885970227200', 'name': 'NFL players'}}, {'domain': {'id': '131', 'name': 'Unified Twitter Taxonomy', 'description': 'A taxonomy of user interests. '}, 'entity': {'id': '1418358396516851713', 'name': 'Ko-fi'}}, {'domain': {'id': '10', 'name': 'Person', 'description': 'Named people in the world like Nelson Mandela'}, 'entity': {'id': '733774535133028352', 'name': 'Pep Guardiola'}}, {'domain': {'id': '11', 'name': 'Sport', 'description': 'Types of sports, like soccer and basketball'}, 'entity': {'id': '733756536430809088', 'name': 'Soccer'}}, {'domain': {'id': '12', 'name': 'Sports Team', 'description': 'A sports team organization, like Arsenal and the Boston Celtics'}, 'entity': {'id': '731226183572934657', 'name': 'Manchester United'}}, {'domain': {'id': '12', 'name': 'Sports Team', 'description': 'A sports team organization, like Arsenal and the Boston Celtics'}, 'entity': {'id': '731226241894752257', 'name': 'Arsenal'}}, {'domain': {'id': '93', 'name': 'Coach', 'description': ""A Coach like 'Bill Belichick'""}, 'entity': {'id': '733774535133028352', 'name': 'Pep Guardiola'}}, {'domain': {'id': '131', 'name': 'Unified Twitter Taxonomy', 'description': 'A taxonomy of user interests. '}, 'entity': {'id': '731226183572934657', 'name': 'Manchester United'}}, {'domain': {'id': '131', 'name': 'Unified Twitter Taxonomy', 'description': 'A taxonomy of user interests. '}, 'entity': {'id': '731226241894752257', 'name': 'Arsenal'}}, {'domain': {'id': '131', 'name': 'Unified Twitter Taxonomy', 'description': 'A taxonomy of user interests. '}, 'entity': {'id': '733756536430809088', 'name': 'Soccer'}}, {'domain': {'id': '131', 'name': 'Unified Twitter Taxonomy', 'description': 'A taxonomy of user interests. '}, 'entity': {'id': '733774535133028352', 'name': 'Pep Guardiola'}}, {'domain': {'id': '131', 'name': 'Unified Twitter Taxonomy', 'description': 'A taxonomy of user interests. '}, 'entity': {'id': '847900493514891265', 'name': 'Sports', 'description': 'Sports'}}, {'domain': {'id': '131', 'name': 'Unified Twitter Taxonomy', 'description': 'A taxonomy of user interests. '}, 'entity': {'id': '1285942425861545984', 'name': 'Sports figures'}}]"
"We win big tomorrow❤️

#Arsenal #MUFC #PepGuardiola #PRSKSummit2024 #RangersPassout2024 #Saka #Kofi #JerryJeudy #BoNix #stayhumble  #GrandeFratello https://t.co/a0njII6JP8",2024-12-03 11:52:14,"[{'domain': {'id': '10', 'name': 'Person', 'description': 'Named people in the world like Nelson Mandela'}, 'entity': {'id': '1068326513798373376', 'name': 'Bukayo Saka'}}, {'domain': {'id': '10', 'name': 'Person', 'description': 'Named people in the world like Nelson Mandela'}, 'entity': {'id': '1253592351043284996', 'name': 'Jerry Jeudy'}}, {'domain': {'id': '46', 'name': 'Business Taxonomy', 'description': 'Categories within Brand Verticals that narrow down the scope of Brands'}, 'entity': {'id': '1557697289971322880', 'name': 'Sports & Fitness Business', 'description': 'Brands, companies, advertisers and every non-person handle with the profit intent related to sports nutrition, athletic apparel, sports apps, fitness venues'}}, {'domain': {'id': '47', 'name': 'Brand', 'description': 'Brands and Companies'}, 'entity': {'id': '1418358396516851713', 'name': 'Ko-fi'}}, {'domain': {'id': '60', 'name': 'Athlete', 'description': 'An athlete in the world, like Serena Williams or Lionel Messi'}, 'entity': {'id': '1068326513798373376', 'name': 'Bukayo Saka'}}, {'domain': {'id': '60', 'name': 'Athlete', 'description': 'An athlete in the world, like Serena Williams or Lionel Messi'}, 'entity': {'id': '1253592351043284996', 'name': 'Jerry Jeudy'}}, {'domain': {'id': '131', 'name': 'Unified Twitter Taxonomy', 'description': 'A taxonomy of user interests. '}, 'entity': {'id': '689566306014617600', 'name': 'American football'}}, {'domain': {'id': '131', 'name': 'Unified Twitter Taxonomy', 'description': 'A taxonomy of user interests. '}, 'entity': {'id': '689566314835259392', 'name': 'NFL'}}, {'domain': {'id': '131', 'name': 'Unified Twitter Taxonomy', 'description': 'A taxonomy of user interests. '}, 'entity': {'id': '733756536430809088', 'name': 'Soccer'}}, {'domain': {'id': '131', 'name': 'Unified Twitter Taxonomy', 'description': 'A taxonomy of user interests. '}, 'entity': {'id': '847900493514891265', 'name': 'Sports', 'description': 'Sports'}}, {'domain': {'id': '131', 'name': 'Unified Twitter Taxonomy', 'description': 'A taxonomy of user interests. '}, 'entity': {'id': '1068326513798373376', 'name': 'Bukayo Saka'}}, {'domain': {'id': '131', 'name': 'Unified Twitter Taxonomy', 'description': 'A taxonomy of user interests. '}, 'entity': {'id': '1253592351043284996', 'name': 'Jerry Jeudy'}}, {'domain': {'id': '131', 'name': 'Unified Twitter Taxonomy', 'description': 'A taxonomy of user interests. '}, 'entity': {'id': '1263187885970227200', 'name': 'NFL players'}}, {'domain': {'id': '131', 'name': 'Unified Twitter Taxonomy', 'description': 'A taxonomy of user interests. '}, 'entity': {'id': '1418358396516851713', 'name': 'Ko-fi'}}, {'domain': {'id': '10', 'name': 'Person', 'description': 'Named people in the world like Nelson Mandela'}, 'entity': {'id': '733774535133028352', 'name': 'Pep Guardiola'}}, {'domain': {'id': '11', 'name': 'Sport', 'description': 'Types of sports, like soccer and basketball'}, 'entity': {'id': '733756536430809088', 'name': 'Soccer'}}, {'domain': {'id': '12', 'name': 'Sports Team', 'description': 'A sports team organization, like Arsenal and the Boston Celtics'}, 'entity': {'id': '731226183572934657', 'name': 'Manchester United'}}, {'domain': {'id': '12', 'name': 'Sports Team', 'description': 'A sports team organization, like Arsenal and the Boston Celtics'}, 'entity': {'id': '731226241894752257', 'name': 'Arsenal'}}, {'domain': {'id': '93', 'name': 'Coach', 'description': ""A Coach like 'Bill Belichick'""}, 'entity': {'id': '733774535133028352', 'name': 'Pep Guardiola'}}, {'domain': {'id': '131', 'name': 'Unified Twitter Taxonomy', 'description': 'A taxonomy of user interests. '}, 'entity': {'id': '731226183572934657', 'name': 'Manchester United'}}, {'domain': {'id': '131', 'name': 'Unified Twitter Taxonomy', 'description': 'A taxonomy of user interests. '}, 'entity': {'id': '731226241894752257', 'name': 'Arsenal'}}, {'domain': {'id': '131', 'name': 'Unified Twitter Taxonomy', 'description': 'A taxonomy of user interests. '}, 'entity': {'id': '733756536430809088', 'name': 'Soccer'}}, {'domain': {'id': '131', 'name': 'Unified Twitter Taxonomy', 'description': 'A taxonomy of user interests. '}, 'entity': {'id': '733774535133028352', 'name': 'Pep Guardiola'}}, {'domain': {'id': '131', 'name': 'Unified Twitter Taxonomy', 'description': 'A taxonomy of user interests. '}, 'entity': {'id': '847900493514891265', 'name': 'Sports', 'description': 'Sports'}}, {'domain': {'id': '131', 'name': 'Unified Twitter Taxonomy', 'description': 'A taxonomy of user interests. '}, 'entity': {'id': '1285942425861545984', 'name': 'Sports figures'}}]"
The government is feeling heat especially the livestock wing of ODM. Joho is so jilted. Salamu ziendelee. #PepGuardiola #Junet #Joho #Devki,2024-12-03 11:36:21,"[{'domain': {'id': '46', 'name': 'Business Taxonomy', 'description': 'Categories within Brand Verticals that narrow down the scope of Brands'}, 'entity': {'id': '1557697289971322880', 'name': 'Sports & Fitness Business', 'description': 'Brands, companies, advertisers and every non-person handle with the profit intent related to sports nutrition, athletic apparel, sports apps, fitness venues'}}, {'domain': {'id': '10', 'name': 'Person', 'description': 'Named people in the world like Nelson Mandela'}, 'entity': {'id': '733774535133028352', 'name': 'Pep Guardiola'}}, {'domain': {'id': '11', 'name': 'Sport', 'description': 'Types of sports, like soccer and basketball'}, 'entity': {'id': '733756536430809088', 'name': 'Soccer'}}, {'domain': {'id': '93', 'name': 'Coach', 'description': ""A Coach like 'Bill Belichick'""}, 'entity': {'id': '733774535133028352', 'name': 'Pep Guardiola'}}, {'domain': {'id': '131', 'name': 'Unified Twitter Taxonomy', 'description': 'A taxonomy of user interests. '}, 'entity': {'id': '733756536430809088', 'name': 'Soccer'}}, {'domain': {'id': '131', 'name': 'Unified Twitter Taxonomy', 'description': 'A taxonomy of user interests. '}, 'entity': {'id': '733774535133028352', 'name': 'Pep Guardiola'}}, {'domain': {'id': '131', 'name': 'Unified Twitter Taxonomy', 'description': 'A taxonomy of user interests. '}, 'entity': {'id': '847900493514891265', 'name': 'Sports', 'description': 'Sports'}}, {'domain': {'id': '131', 'name': 'Unified Twitter Taxonomy', 'description': 'A taxonomy of user interests. '}, 'entity': {'id': '1285942425861545984', 'name': 'Sports figures'}}]"
"From Sweden &amp; Finland’s latest developments to #Wundanyi's growth, Nelson Havi’s insights, and Kenyatta's leadership – there’s a lot happening! Also, big shoutout to #Airtel for making waves and #PepGuardiola for his game-changing strategies. 🇸🇪🇫🇮🇰🇪⚽ #Innovation #Leadership",2024-12-03 10:45:48,"[{'domain': {'id': '46', 'name': 'Business Taxonomy', 'description': 'Categories within Brand Verticals that narrow down the scope of Brands'}, 'entity': {'id': '1557697289971322880', 'name': 'Sports & Fitness Business', 'description': 'Brands, companies, advertisers and every non-person handle with the profit intent related to sports nutrition, athletic apparel, sports apps, fitness venues'}}, {'domain': {'id': '10', 'name': 'Person', 'description': 'Named people in the world like Nelson Mandela'}, 'entity': {'id': '733774535133028352', 'name': 'Pep Guardiola'}}, {'domain': {'id': '11', 'name': 'Sport', 'description': 'Types of sports, like soccer and basketball'}, 'entity': {'id': '733756536430809088', 'name': 'Soccer'}}, {'domain': {'id': '93', 'name': 'Coach', 'description': ""A Coach like 'Bill Belichick'""}, 'entity': {'id': '733774535133028352', 'name': 'Pep Guardiola'}}, {'domain': {'id': '131', 'name': 'Unified Twitter Taxonomy', 'description': 'A taxonomy of user interests. '}, 'entity': {'id': '733756536430809088', 'name': 'Soccer'}}, {'domain': {'id': '131', 'name': 'Unified Twitter Taxonomy', 'description': 'A taxonomy of user interests. '}, 'entity': {'id': '733774535133028352', 'name': 'Pep Guardiola'}}, {'domain': {'id': '131', 'name': 'Unified Twitter Taxonomy', 'description': 'A taxonomy of user interests. '}, 'entity': {'id': '847900493514891265', 'name': 'Sports', 'description': 'Sports'}}, {'domain': {'id': '131', 'name': 'Unified Twitter Taxonomy', 'description': 'A taxonomy of user interests. '}, 'entity': {'id': '1285942425861545984', 'name': 'Sports figures'}}]"
"Acacia Premier Hotel in Kisumu is the one place where you discover the perfect blend of luxury and serenity. Perched on the shores of Lake Victoria, it is a stunning piece of hospitality architecture makes you feel like every moment you live is a dream.

#Aoko #PepGuardiola https://t.co/LkNcgCk2g8",2024-12-03 10:28:57,"[{'domain': {'id': '46', 'name': 'Business Taxonomy', 'description': 'Categories within Brand Verticals that narrow down the scope of Brands'}, 'entity': {'id': '1557697289971322880', 'name': 'Sports & Fitness Business', 'description': 'Brands, companies, advertisers and every non-person handle with the profit intent related to sports nutrition, athletic apparel, sports apps, fitness venues'}}, {'domain': {'id': '46', 'name': 'Business Taxonomy', 'description': 'Categories within Brand Verticals that narrow down the scope of Brands'}, 'entity': {'id': '1557697439489880065', 'name': 'Travel & Transportation Business', 'description': 'Brands, companies, advertisers and every non-person handle with the profit intent related to travel as airlines, travel agencies, hotels'}}, {'domain': {'id': '131', 'name': 'Unified Twitter Taxonomy', 'description': 'A taxonomy of user interests. '}, 'entity': {'id': '1277995430236680192', 'name': 'Outdoors'}}, {'domain': {'id': '131', 'name': 'Unified Twitter Taxonomy', 'description': 'A taxonomy of user interests. '}, 'entity': {'id': '1579638047917817856', 'name': 'Hospitality'}}, {'domain': {'id': '10', 'name': 'Person', 'description': 'Named people in the world like Nelson Mandela'}, 'entity': {'id': '733774535133028352', 'name': 'Pep Guardiola'}}, {'domain': {'id': '11', 'name': 'Sport', 'description': 'Types of sports, like soccer and basketball'}, 'entity': {'id': '733756536430809088', 'name': 'Soccer'}}, {'domain': {'id': '30', 'name': 'Entities [Entity Service]', 'description': 'Entity Service top level domain, every item that is in Entity Service should be in this domain'}, 'entity': {'id': '839159814991167489', 'name': 'Travel', 'description': 'Travel'}}, {'domain': {'id': '66', 'name': 'Interests and Hobbies Category', 'description': 'A grouping of interests and hobbies entities, like Novelty Food or Destinations'}, 'entity': {'id': '864938653063159808', 'name': 'Hospitality', 'description': 'Hospitality'}}, {'domain': {'id': '67', 'name': 'Interests and Hobbies', 'description': 'Interests, opinions, and behaviors of individuals, groups, or cultures; like Speciality Cooking or Theme Parks'}, 'entity': {'id': '864939492947275776', 'name': 'Hotel/Motel', 'description': 'Hotel/Motel'}}, {'domain': {'id': '93', 'name': 'Coach', 'description': ""A Coach like 'Bill Belichick'""}, 'entity': {'id': '733774535133028352', 'name': 'Pep Guardiola'}}, {'domain': {'id': '131', 'name': 'Unified Twitter Taxonomy', 'description': 'A taxonomy of user interests. '}, 'entity': {'id': '733756536430809088', 'name': 'Soccer'}}, {'domain': {'id': '131', 'name': 'Unified Twitter Taxonomy', 'description': 'A taxonomy of user interests. '}, 'entity': {'id': '733774535133028352', 'name': 'Pep Guardiola'}}, {'domain': {'id': '131', 'name': 'Unified Twitter Taxonomy', 'description': 'A taxonomy of user interests. '}, 'entity': {'id': '847900493514891265', 'name': 'Sports', 'description': 'Sports'}}, {'domain': {'id': '131', 'name': 'Unified Twitter Taxonomy', 'description': 'A taxonomy of user interests. '}, 'entity': {'id': '1285942425861545984', 'name': 'Sports figures'}}]"
