text,created_at,context_annotations
"Shocking Truth About Man City's Dilemma! 🏆😱
#ManCity #PepGuardiola #PremierLeague #FootballAnalysis #GrealishContract #SportsDiscussion #SoccerInsights #TeamDynamics #FootballDrama #WinlessStreak https://t.co/vFaweA2GaX",2024-12-03 20:10:25,"[{'domain': {'id': '3', 'name': 'TV Shows', 'description': 'Television shows from around the world'}, 'entity': {'id': '10000277815', 'name': 'English Premier League Soccer', 'description': 'Action from English Premier League Soccer matches.'}}, {'domain': {'id': '3', 'name': 'TV Shows', 'description': 'Television shows from around the world'}, 'entity': {'id': '10027427957', 'name': 'Barclays Premier League Football', 'description': 'Live football coverage of a match from the Premier League.'}}, {'domain': {'id': '3', 'name': 'TV Shows', 'description': 'Television shows from around the world'}, 'entity': {'id': '10029304591', 'name': 'Barclays Premier League Soccer'}}, {'domain': {'id': '3', 'name': 'TV Shows', 'description': 'Television shows from around the world'}, 'entity': {'id': '10053653751', 'name': 'Premier League'}}, {'domain': {'id': '6', 'name': 'Sports Event'}, 'entity': {'id': '1847793679592738816', 'name': 'Manchester City vs Nottingham Forest'}}, {'domain': {'id': '11', 'name': 'Sport', 'description': 'Types of sports, like soccer and basketball'}, 'entity': {'id': '733756536430809088', 'name': 'Soccer'}}, {'domain': {'id': '26', 'name': 'Sports League', 'description': ''}, 'entity': {'id': '731226211804794880', 'name': 'England - Soccer'}}, {'domain': {'id': '26', 'name': 'Sports League', 'description': ''}, 'entity': {'id': '733756526872006656', 'name': 'Premier League'}}, {'domain': {'id': '29', 'name': 'Events [Entity Service]', 'description': 'Real world events. '}, 'entity': {'id': '1847793679592738816', 'name': 'Manchester City vs Nottingham Forest'}}, {'domain': {'id': '43', 'name': 'Soccer Match', 'description': 'Sports Event specific to Soccer matches'}, 'entity': {'id': '1847793679592738816', 'name': 'Manchester City vs Nottingham Forest'}}, {'domain': {'id': '46', 'name': 'Business Taxonomy', 'description': 'Categories within Brand Verticals that narrow down the scope of Brands'}, 'entity': {'id': '1557697289971322880', 'name': 'Sports & Fitness Business', 'description': 'Brands, companies, advertisers and every non-person handle with the profit intent related to sports nutrition, athletic apparel, sports apps, fitness venues'}}, {'domain': {'id': '131', 'name': 'Unified Twitter Taxonomy', 'description': 'A taxonomy of user interests. '}, 'entity': {'id': '733756526872006656', 'name': 'Premier League'}}, {'domain': {'id': '131', 'name': 'Unified Twitter Taxonomy', 'description': 'A taxonomy of user interests. '}, 'entity': {'id': '733756536430809088', 'name': 'Soccer'}}, {'domain': {'id': '131', 'name': 'Unified Twitter Taxonomy', 'description': 'A taxonomy of user interests. '}, 'entity': {'id': '847900493514891265', 'name': 'Sports', 'description': 'Sports'}}, {'domain': {'id': '10', 'name': 'Person', 'description': 'Named people in the world like Nelson Mandela'}, 'entity': {'id': '733774535133028352', 'name': 'Pep Guardiola'}}, {'domain': {'id': '11', 'name': 'Sport', 'description': 'Types of sports, like soccer and basketball'}, 'entity': {'id': '733756536430809088', 'name': 'Soccer'}}, {'domain': {'id': '12', 'name': 'Sports Team', 'description': 'A sports team organization, like Arsenal and the Boston Celtics'}, 'entity': {'id': '731226203856637952', 'name': 'Manchester City'}}, {'domain': {'id': '93', 'name': 'Coach', 'description': ""A Coach like 'Bill Belichick'""}, 'entity': {'id': '733774535133028352', 'name': 'Pep Guardiola'}}, {'domain': {'id': '131', 'name': 'Unified Twitter Taxonomy', 'description': 'A taxonomy of user interests. '}, 'entity': {'id': '731226203856637952', 'name': 'Manchester City'}}, {'domain': {'id': '131', 'name': 'Unified Twitter Taxonomy', 'description': 'A taxonomy of user interests. '}, 'entity': {'id': '733756536430809088', 'name': 'Soccer'}}, {'domain': {'id': '131', 'name': 'Unified Twitter Taxonomy', 'description': 'A taxonomy of user interests. '}, 'entity': {'id': '733774535133028352', 'name': 'Pep Guardiola'}}, {'domain': {'id': '131', 'name': 'Unified Twitter Taxonomy', 'description': 'A taxonomy of user interests. '}, 'entity': {'id': '847900493514891265', 'name': 'Sports', 'description': 'Sports'}}, {'domain': {'id': '131', 'name': 'Unified Twitter Taxonomy', 'description': 'A taxonomy of user interests. '}, 'entity': {'id': '1285942425861545984', 'name': 'Sports figures'}}, {'domain': {'id': '29', 'name': 'Events [Entity Service]', 'description': 'Real world events. '}, 'entity': {'id': '733756526872006656', 'name': 'Premier League'}}]"
@ManCity @PhilFoden @rubendias @NathanAke We are winning tomorrow. Who is with me? #ManCity #PepGuardiola  #PremierLeague,2024-12-03 19:37:44,"[{'domain': {'id': '3', 'name': 'TV Shows', 'description': 'Television shows from around the world'}, 'entity': {'id': '10000277815', 'name': 'English Premier League Soccer', 'description': 'Action from English Premier League Soccer matches.'}}, {'domain': {'id': '3', 'name': 'TV Shows', 'description': 'Television shows from around the world'}, 'entity': {'id': '10027427957', 'name': 'Barclays Premier League Football', 'description': 'Live football coverage of a match from the Premier League.'}}, {'domain': {'id': '3', 'name': 'TV Shows', 'description': 'Television shows from around the world'}, 'entity': {'id': '10029304591', 'name': 'Barclays Premier League Soccer'}}, {'domain': {'id': '3', 'name': 'TV Shows', 'description': 'Television shows from around the world'}, 'entity': {'id': '10053653751', 'name': 'Premier League'}}, {'domain': {'id': '6', 'name': 'Sports Event'}, 'entity': {'id': '1847793679592738816', 'name': 'Manchester City vs Nottingham Forest'}}, {'domain': {'id': '11', 'name': 'Sport', 'description': 'Types of sports, like soccer and basketball'}, 'entity': {'id': '733756536430809088', 'name': 'Soccer'}}, {'domain': {'id': '26', 'name': 'Sports League', 'description': ''}, 'entity': {'id': '731226211804794880', 'name': 'England - Soccer'}}, {'domain': {'id': '26', 'name': 'Sports League', 'description': ''}, 'entity': {'id': '733756526872006656', 'name': 'Premier League'}}, {'domain': {'id': '29', 'name': 'Events [Entity Service]', 'description': 'Real world events. '}, 'entity': {'id': '1847793679592738816', 'name': 'Manchester City vs Nottingham Forest'}}, {'domain': {'id': '43', 'name': 'Soccer Match', 'description': 'Sports Event specific to Soccer matches'}, 'entity': {'id': '1847793679592738816', 'name': 'Manchester City vs Nottingham Forest'}}, {'domain': {'id': '46', 'name': 'Business Taxonomy', 'description': 'Categories within Brand Verticals that narrow down the scope of Brands'}, 'entity': {'id': '1557697289971322880', 'name': 'Sports & Fitness Business', 'description': 'Brands, companies, advertisers and every non-person handle with the profit intent related to sports nutrition, athletic apparel, sports apps, fitness venues'}}, {'domain': {'id': '131', 'name': 'Unified Twitter Taxonomy', 'description': 'A taxonomy of user interests. '}, 'entity': {'id': '733756526872006656', 'name': 'Premier League'}}, {'domain': {'id': '131', 'name': 'Unified Twitter Taxonomy', 'description': 'A taxonomy of user interests. '}, 'entity': {'id': '733756536430809088', 'name': 'Soccer'}}, {'domain': {'id': '131', 'name': 'Unified Twitter Taxonomy', 'description': 'A taxonomy of user interests. '}, 'entity': {'id': '847900493514891265', 'name': 'Sports', 'description': 'Sports'}}, {'domain': {'id': '10', 'name': 'Person', 'description': 'Named people in the world like Nelson Mandela'}, 'entity': {'id': '733774311203295232', 'name': 'Nathan Ake'}}, {'domain': {'id': '10', 'name': 'Person', 'description': 'Named people in the world like Nelson Mandela'}, 'entity': {'id': '733774535133028352', 'name': 'Pep Guardiola'}}, {'domain': {'id': '10', 'name': 'Person', 'description': 'Named people in the world like Nelson Mandela'}, 'entity': {'id': '806350960108785664', 'name': 'Phil Foden'}}, {'domain': {'id': '11', 'name': 'Sport', 'description': 'Types of sports, like soccer and basketball'}, 'entity': {'id': '733756536430809088', 'name': 'Soccer'}}, {'domain': {'id': '12', 'name': 'Sports Team', 'description': 'A sports team organization, like Arsenal and the Boston Celtics'}, 'entity': {'id': '731226203856637952', 'name': 'Manchester City'}}, {'domain': {'id': '60', 'name': 'Athlete', 'description': 'An athlete in the world, like Serena Williams or Lionel Messi'}, 'entity': {'id': '733774311203295232', 'name': 'Nathan Ake'}}, {'domain': {'id': '60', 'name': 'Athlete', 'description': 'An athlete in the world, like Serena Williams or Lionel Messi'}, 'entity': {'id': '806350960108785664', 'name': 'Phil Foden'}}, {'domain': {'id': '93', 'name': 'Coach', 'description': ""A Coach like 'Bill Belichick'""}, 'entity': {'id': '733774535133028352', 'name': 'Pep Guardiola'}}, {'domain': {'id': '131', 'name': 'Unified Twitter Taxonomy', 'description': 'A taxonomy of user interests. '}, 'entity': {'id': '731226203856637952', 'name': 'Manchester City'}}, {'domain': {'id': '131', 'name': 'Unified Twitter Taxonomy', 'description': 'A taxonomy of user interests. '}, 'entity': {'id': '733756536430809088', 'name': 'Soccer'}}, {'domain': {'id': '131', 'name': 'Unified Twitter Taxonomy', 'description': 'A taxonomy of user interests. '}, 'entity': {'id': '733774311203295232', 'name': 'Nathan Ake'}}, {'domain': {'id': '131', 'name': 'Unified Twitter Taxonomy', 'description': 'A taxonomy of user interests. '}, 'entity': {'id': '733774535133028352', 'name': 'Pep Guardiola'}}, {'domain': {'id': '131', 'name': 'Unified Twitter Taxonomy', 'description': 'A taxonomy of user interests. '}, 'entity': {'id': '806350960108785664', 'name': 'Phil Foden'}}, {'domain': {'id': '131', 'name': 'Unified Twitter Taxonomy', 'description': 'A taxonomy of user interests. '}, 'entity': {'id': '847900493514891265', 'name': 'Sports', 'description': 'Sports'}}, {'domain': {'id': '131', 'name': 'Unified Twitter Taxonomy', 'description': 'A taxonomy of user interests. '}, 'entity': {'id': '1285942425861545984', 'name': 'Sports figures'}}, {'domain': {'id': '29', 'name': 'Events [Entity Service]', 'description': 'Real world events. '}, 'entity': {'id': '733756526872006656', 'name': 'Premier League'}}]"
"Can Man City force a comeback? 🤔

Read More: https://t.co/CXCIUAsCTg

#ManchesterCity #PepGuardiola https://t.co/1qxxMuL30W",2024-12-03 18:51:14,"[{'domain': {'id': '46', 'name': 'Business Taxonomy', 'description': 'Categories within Brand Verticals that narrow down the scope of Brands'}, 'entity': {'id': '1557697289971322880', 'name': 'Sports & Fitness Business', 'description': 'Brands, companies, advertisers and every non-person handle with the profit intent related to sports nutrition, athletic apparel, sports apps, fitness venues'}}, {'domain': {'id': '10', 'name': 'Person', 'description': 'Named people in the world like Nelson Mandela'}, 'entity': {'id': '733774535133028352', 'name': 'Pep Guardiola'}}, {'domain': {'id': '11', 'name': 'Sport', 'description': 'Types of sports, like soccer and basketball'}, 'entity': {'id': '733756536430809088', 'name': 'Soccer'}}, {'domain': {'id': '12', 'name': 'Sports Team', 'description': 'A sports team organization, like Arsenal and the Boston Celtics'}, 'entity': {'id': '731226203856637952', 'name': 'Manchester City'}}, {'domain': {'id': '93', 'name': 'Coach', 'description': ""A Coach like 'Bill Belichick'""}, 'entity': {'id': '733774535133028352', 'name': 'Pep Guardiola'}}, {'domain': {'id': '131', 'name': 'Unified Twitter Taxonomy', 'description': 'A taxonomy of user interests. '}, 'entity': {'id': '731226203856637952', 'name': 'Manchester City'}}, {'domain': {'id': '131', 'name': 'Unified Twitter Taxonomy', 'description': 'A taxonomy of user interests. '}, 'entity': {'id': '733756536430809088', 'name': 'Soccer'}}, {'domain': {'id': '131', 'name': 'Unified Twitter Taxonomy', 'description': 'A taxonomy of user interests. '}, 'entity': {'id': '733774535133028352', 'name': 'Pep Guardiola'}}, {'domain': {'id': '131', 'name': 'Unified Twitter Taxonomy', 'description': 'A taxonomy of user interests. '}, 'entity': {'id': '847900493514891265', 'name': 'Sports', 'description': 'Sports'}}, {'domain': {'id': '131', 'name': 'Unified Twitter Taxonomy', 'description': 'A taxonomy of user interests. '}, 'entity': {'id': '1285942425861545984', 'name': 'Sports figures'}}]"
@NFFC are going to get the @ManCity backlash this weekend mark my words #ManchesterCity #Nottinghamforest #PepGuardiola,2024-12-03 18:50:15,"[{'domain': {'id': '12', 'name': 'Sports Team', 'description': 'A sports team organization, like Arsenal and the Boston Celtics'}, 'entity': {'id': '731226231404793857', 'name': 'Nottingham Forest FC'}}, {'domain': {'id': '46', 'name': 'Business Taxonomy', 'description': 'Categories within Brand Verticals that narrow down the scope of Brands'}, 'entity': {'id': '1557697289971322880', 'name': 'Sports & Fitness Business', 'description': 'Brands, companies, advertisers and every non-person handle with the profit intent related to sports nutrition, athletic apparel, sports apps, fitness venues'}}, {'domain': {'id': '131', 'name': 'Unified Twitter Taxonomy', 'description': 'A taxonomy of user interests. '}, 'entity': {'id': '731226231404793857', 'name': 'Nottingham Forest FC'}}, {'domain': {'id': '131', 'name': 'Unified Twitter Taxonomy', 'description': 'A taxonomy of user interests. '}, 'entity': {'id': '733756536430809088', 'name': 'Soccer'}}, {'domain': {'id': '131', 'name': 'Unified Twitter Taxonomy', 'description': 'A taxonomy of user interests. '}, 'entity': {'id': '847900493514891265', 'name': 'Sports', 'description': 'Sports'}}, {'domain': {'id': '10', 'name': 'Person', 'description': 'Named people in the world like Nelson Mandela'}, 'entity': {'id': '733774535133028352', 'name': 'Pep Guardiola'}}, {'domain': {'id': '11', 'name': 'Sport', 'description': 'Types of sports, like soccer and basketball'}, 'entity': {'id': '733756536430809088', 'name': 'Soccer'}}, {'domain': {'id': '12', 'name': 'Sports Team', 'description': 'A sports team organization, like Arsenal and the Boston Celtics'}, 'entity': {'id': '731226203856637952', 'name': 'Manchester City'}}, {'domain': {'id': '93', 'name': 'Coach', 'description': ""A Coach like 'Bill Belichick'""}, 'entity': {'id': '733774535133028352', 'name': 'Pep Guardiola'}}, {'domain': {'id': '131', 'name': 'Unified Twitter Taxonomy', 'description': 'A taxonomy of user interests. '}, 'entity': {'id': '731226203856637952', 'name': 'Manchester City'}}, {'domain': {'id': '131', 'name': 'Unified Twitter Taxonomy', 'description': 'A taxonomy of user interests. '}, 'entity': {'id': '733756536430809088', 'name': 'Soccer'}}, {'domain': {'id': '131', 'name': 'Unified Twitter Taxonomy', 'description': 'A taxonomy of user interests. '}, 'entity': {'id': '733774535133028352', 'name': 'Pep Guardiola'}}, {'domain': {'id': '131', 'name': 'Unified Twitter Taxonomy', 'description': 'A taxonomy of user interests. '}, 'entity': {'id': '847900493514891265', 'name': 'Sports', 'description': 'Sports'}}, {'domain': {'id': '131', 'name': 'Unified Twitter Taxonomy', 'description': 'A taxonomy of user interests. '}, 'entity': {'id': '1285942425861545984', 'name': 'Sports figures'}}]"
"Till this date I wish @neymarjr to be back in @FCBarcelona 

#Barca #FCB #PepGuardiola #neymarjr #LaLigaHighlights https://t.co/emQcoohvTf",2024-12-03 18:21:06,"[{'domain': {'id': '6', 'name': 'Sports Event'}, 'entity': {'id': '1847793679592804355', 'name': 'RCD Mallorca vs FC Barcelona'}}, {'domain': {'id': '10', 'name': 'Person', 'description': 'Named people in the world like Nelson Mandela'}, 'entity': {'id': '733774105166548992', 'name': 'Neymar '}}, {'domain': {'id': '12', 'name': 'Sports Team', 'description': 'A sports team organization, like Arsenal and the Boston Celtics'}, 'entity': {'id': '731226255836598272', 'name': 'FC Barcelona'}}, {'domain': {'id': '26', 'name': 'Sports League', 'description': ''}, 'entity': {'id': '731226215760027649', 'name': 'Spain - Soccer'}}, {'domain': {'id': '26', 'name': 'Sports League', 'description': ''}, 'entity': {'id': '733756520714752000', 'name': 'La Liga'}}, {'domain': {'id': '29', 'name': 'Events [Entity Service]', 'description': 'Real world events. '}, 'entity': {'id': '1847793679592804355', 'name': 'RCD Mallorca vs FC Barcelona'}}, {'domain': {'id': '43', 'name': 'Soccer Match', 'description': 'Sports Event specific to Soccer matches'}, 'entity': {'id': '1847793679592804355', 'name': 'RCD Mallorca vs FC Barcelona'}}, {'domain': {'id': '46', 'name': 'Business Taxonomy', 'description': 'Categories within Brand Verticals that narrow down the scope of Brands'}, 'entity': {'id': '1557697289971322880', 'name': 'Sports & Fitness Business', 'description': 'Brands, companies, advertisers and every non-person handle with the profit intent related to sports nutrition, athletic apparel, sports apps, fitness venues'}}, {'domain': {'id': '60', 'name': 'Athlete', 'description': 'An athlete in the world, like Serena Williams or Lionel Messi'}, 'entity': {'id': '733774105166548992', 'name': 'Neymar '}}, {'domain': {'id': '131', 'name': 'Unified Twitter Taxonomy', 'description': 'A taxonomy of user interests. '}, 'entity': {'id': '731226255836598272', 'name': 'FC Barcelona'}}, {'domain': {'id': '131', 'name': 'Unified Twitter Taxonomy', 'description': 'A taxonomy of user interests. '}, 'entity': {'id': '733756536430809088', 'name': 'Soccer'}}, {'domain': {'id': '131', 'name': 'Unified Twitter Taxonomy', 'description': 'A taxonomy of user interests. '}, 'entity': {'id': '733774105166548992', 'name': 'Neymar '}}, {'domain': {'id': '131', 'name': 'Unified Twitter Taxonomy', 'description': 'A taxonomy of user interests. '}, 'entity': {'id': '847900493514891265', 'name': 'Sports', 'description': 'Sports'}}, {'domain': {'id': '10', 'name': 'Person', 'description': 'Named people in the world like Nelson Mandela'}, 'entity': {'id': '733774535133028352', 'name': 'Pep Guardiola'}}, {'domain': {'id': '11', 'name': 'Sport', 'description': 'Types of sports, like soccer and basketball'}, 'entity': {'id': '733756536430809088', 'name': 'Soccer'}}, {'domain': {'id': '12', 'name': 'Sports Team', 'description': 'A sports team organization, like Arsenal and the Boston Celtics'}, 'entity': {'id': '731226255836598272', 'name': 'FC Barcelona'}}, {'domain': {'id': '26', 'name': 'Sports League', 'description': ''}, 'entity': {'id': '733756520714752000', 'name': 'La Liga'}}, {'domain': {'id': '93', 'name': 'Coach', 'description': ""A Coach like 'Bill Belichick'""}, 'entity': {'id': '733774535133028352', 'name': 'Pep Guardiola'}}, {'domain': {'id': '131', 'name': 'Unified Twitter Taxonomy', 'description': 'A taxonomy of user interests. '}, 'entity': {'id': '733756520714752000', 'name': 'La Liga'}}, {'domain': {'id': '131', 'name': 'Unified Twitter Taxonomy', 'description': 'A taxonomy of user interests. '}, 'entity': {'id': '733756536430809088', 'name': 'Soccer'}}, {'domain': {'id': '131', 'name': 'Unified Twitter Taxonomy', 'description': 'A taxonomy of user interests. '}, 'entity': {'id': '733774535133028352', 'name': 'Pep Guardiola'}}, {'domain': {'id': '131', 'name': 'Unified Twitter Taxonomy', 'description': 'A taxonomy of user interests. '}, 'entity': {'id': '847900493514891265', 'name': 'Sports', 'description': 'Sports'}}, {'domain': {'id': '131', 'name': 'Unified Twitter Taxonomy', 'description': 'A taxonomy of user interests. '}, 'entity': {'id': '1285942425861545984', 'name': 'Sports figures'}}]"
"🚨⚠️ Pep Guardiola: “John Stones is not close to returning yet. De Bruyne is closer and doing even, even better.”

👀 “With the full squad this season, we’ll be close to the level we reached last season,” Pep added. 💪⚽

#ManCity #PepGuardiola #DeBruyne #JohnStones https://t.co/ppKZEJAmfa",2024-12-03 18:01:16,"[{'domain': {'id': '10', 'name': 'Person', 'description': 'Named people in the world like Nelson Mandela'}, 'entity': {'id': '733773989353422849', 'name': 'Kevin De Bruyne'}}, {'domain': {'id': '11', 'name': 'Sport', 'description': 'Types of sports, like soccer and basketball'}, 'entity': {'id': '733756536430809088', 'name': 'Soccer'}}, {'domain': {'id': '46', 'name': 'Business Taxonomy', 'description': 'Categories within Brand Verticals that narrow down the scope of Brands'}, 'entity': {'id': '1557697289971322880', 'name': 'Sports & Fitness Business', 'description': 'Brands, companies, advertisers and every non-person handle with the profit intent related to sports nutrition, athletic apparel, sports apps, fitness venues'}}, {'domain': {'id': '60', 'name': 'Athlete', 'description': 'An athlete in the world, like Serena Williams or Lionel Messi'}, 'entity': {'id': '733773989353422849', 'name': 'Kevin De Bruyne'}}, {'domain': {'id': '131', 'name': 'Unified Twitter Taxonomy', 'description': 'A taxonomy of user interests. '}, 'entity': {'id': '733756536430809088', 'name': 'Soccer'}}, {'domain': {'id': '131', 'name': 'Unified Twitter Taxonomy', 'description': 'A taxonomy of user interests. '}, 'entity': {'id': '733773989353422849', 'name': 'Kevin De Bruyne'}}, {'domain': {'id': '131', 'name': 'Unified Twitter Taxonomy', 'description': 'A taxonomy of user interests. '}, 'entity': {'id': '847900493514891265', 'name': 'Sports', 'description': 'Sports'}}, {'domain': {'id': '10', 'name': 'Person', 'description': 'Named people in the world like Nelson Mandela'}, 'entity': {'id': '733774236720857088', 'name': 'John Stones'}}, {'domain': {'id': '10', 'name': 'Person', 'description': 'Named people in the world like Nelson Mandela'}, 'entity': {'id': '733774535133028352', 'name': 'Pep Guardiola'}}, {'domain': {'id': '11', 'name': 'Sport', 'description': 'Types of sports, like soccer and basketball'}, 'entity': {'id': '733756536430809088', 'name': 'Soccer'}}, {'domain': {'id': '12', 'name': 'Sports Team', 'description': 'A sports team organization, like Arsenal and the Boston Celtics'}, 'entity': {'id': '731226203856637952', 'name': 'Manchester City'}}, {'domain': {'id': '60', 'name': 'Athlete', 'description': 'An athlete in the world, like Serena Williams or Lionel Messi'}, 'entity': {'id': '733774236720857088', 'name': 'John Stones'}}, {'domain': {'id': '93', 'name': 'Coach', 'description': ""A Coach like 'Bill Belichick'""}, 'entity': {'id': '733774535133028352', 'name': 'Pep Guardiola'}}, {'domain': {'id': '131', 'name': 'Unified Twitter Taxonomy', 'description': 'A taxonomy of user interests. '}, 'entity': {'id': '731226203856637952', 'name': 'Manchester City'}}, {'domain': {'id': '131', 'name': 'Unified Twitter Taxonomy', 'description': 'A taxonomy of user interests. '}, 'entity': {'id': '733756536430809088', 'name': 'Soccer'}}, {'domain': {'id': '131', 'name': 'Unified Twitter Taxonomy', 'description': 'A taxonomy of user interests. '}, 'entity': {'id': '733774236720857088', 'name': 'John Stones'}}, {'domain': {'id': '131', 'name': 'Unified Twitter Taxonomy', 'description': 'A taxonomy of user interests. '}, 'entity': {'id': '733774535133028352', 'name': 'Pep Guardiola'}}, {'domain': {'id': '131', 'name': 'Unified Twitter Taxonomy', 'description': 'A taxonomy of user interests. '}, 'entity': {'id': '847900493514891265', 'name': 'Sports', 'description': 'Sports'}}, {'domain': {'id': '131', 'name': 'Unified Twitter Taxonomy', 'description': 'A taxonomy of user interests. '}, 'entity': {'id': '1285942425861545984', 'name': 'Sports figures'}}]"
